invoice_id,job_id,invoice_amount,invoice_date,payment_status,invoice_notes
2297,2520,975,2025-11-25,Pending,Find soldier quality prove might once.
2298,2521,415,2026-02-23,Paid,Teacher have outside and.
2299,2522,1172,2026-02-15,Paid,Picture way lose present mission.
2300,2524,1719,2026-01-04,Paid,Clear young law draw.
2301,2525,2924,2025-12-12,Paid,Me bank best.
2302,2526,3500,2025-06-17,Pending,Amount exist identify doctor suddenly evidence.
2303,2527,1878,2026-02-01,Paid,Wear one also idea look alone reason.
2304,2528,2582,2025-07-22,Paid,Sense again class few.
2305,2529,2850,2025-12-07,Paid,Everybody exactly notice lead.
2306,2530,2006,2025-09-29,Pending,North certainly democratic Congress health.
2307,2531,1833,2026-01-31,Paid,Catch help our middle.
2308,2532,4487,2026-01-28,Paid,Which care suffer entire process.
2309,2533,3835,2026-02-10,Paid,Page watch upon itself agree near model on.
2310,2534,2755,2026-01-08,Overdue,Plan his never toward gun let nothing.
2311,2535,1174,2026-02-24,Paid,Voice knowledge least door.
2312,2536,4437,2026-02-05,Paid,End important give smile same task.
2313,2537,821,2025-01-21,Paid,Nothing us fire significant none.
2314,2538,1694,2026-02-21,Paid,Want American responsibility interesting grow section.
2315,2539,1064,2026-01-26,Paid,Whether whether mother even investment.
2316,2540,3987,2026-01-18,Pending,Part involve appear specific discover.
2317,2541,3049,2026-01-22,Paid,Against sister sort quite.
2318,2542,1141,2025-03-22,Paid,Skill spend boy western rise financial process research.
2319,2543,1948,2026-02-16,Paid,So up staff her while anything.
2320,2544,963,2025-12-10,Paid,Here reach have process after whose.
2321,2546,3294,2026-02-24,Paid,Chair say article.
2322,2547,374,2025-11-25,Paid,Guess stock leg respond stand color degree husband.
2323,2549,3017,2025-11-01,Paid,Single thank drive paper party.
2324,2550,4413,2025-10-21,Overdue,Particular single quite.
2325,2551,2490,2025-12-23,Paid,Boy seat half fund.
2326,2553,2952,2025-12-19,Paid,Young animal expect light.
2327,2554,3695,2025-10-08,Paid,Foreign source third heart team line series.
2328,2555,1285,2026-02-07,Pending,Weight account effect successful democratic.
2329,2556,4421,2025-08-09,Paid,Space relate suffer little.
2330,2557,4528,2025-09-21,Paid,Control professional sometimes others hospital music.
2331,2559,1054,2025-12-17,Paid,Which send none magazine religious trip.
2332,2560,4203,2025-10-17,Pending,Whole local clearly degree minute case second.
2333,2561,2130,2026-01-09,Pending,Cover really own manage store material.
2334,2562,3464,2025-12-27,Pending,Own fight receive win yet.
2335,2565,2760,2025-12-31,Pending,Wife network them population her age possible American.
2336,2566,2824,2025-04-18,Paid,Reveal military fact spring already.
2337,2567,585,2025-11-28,Paid,Always outside enter score present wear wide.
2338,2568,3815,2026-02-19,Overdue,Bill great out eat collection guy gas.
2339,2569,4968,2026-01-20,Paid,Most blood series director.
2340,2570,1329,2025-12-02,Paid,Consumer apply gun provide.
2341,2572,4096,2026-02-24,Paid,Parent data authority candidate kitchen history mean.
2342,2573,2057,2025-12-23,Pending,Past one heart method rather law speak.
2343,2574,2565,2025-07-10,Overdue,Response now meeting quickly film.
2344,2575,4747,2026-02-15,Paid,Friend send music air rather.
2345,2576,1008,2025-10-13,Pending,Determine win blood system night.
2346,2577,4198,2025-11-23,Paid,I black yeah hold one environment.
2347,2579,334,2025-08-12,Paid,Staff turn shake consumer.
2348,2580,1498,2026-01-03,Paid,Method prevent last task throughout sing member.
2349,2581,4813,2026-02-18,Paid,Throw dinner local language rock spring heavy.
2350,2582,2933,2025-09-07,Paid,Son leader forward away race great final.
2351,2583,4423,2025-11-05,Paid,Eat discussion move raise coach road medical.
2352,2584,262,2026-01-24,Paid,His total build.
2353,2585,1017,2026-01-22,Paid,Unit feeling tree computer song discover appear.
2354,2586,3891,2025-12-14,Paid,Camera number enough customer actually.
2355,2587,3102,2025-10-26,Paid,So discussion animal road month Mr reach.
2356,2588,4818,2025-10-27,Pending,Eye Mrs campaign wife.
2357,2589,4413,2025-10-31,Pending,Marriage Congress something natural really.
2358,2590,4387,2026-01-09,Pending,Necessary easy agent during major.
2359,2592,1814,2025-04-12,Paid,Style wonder industry.
2360,2593,491,2026-01-01,Paid,His police price fire avoid.
2361,2594,590,2025-05-04,Paid,Purpose chair care respond onto receive.
2362,2596,1711,2025-10-01,Paid,Happy stop enter year environmental war money move.
2363,2597,2471,2026-02-11,Paid,Religious letter all our western base ten.
2364,2598,4802,2025-10-24,Pending,Worry no boy.
2365,2599,3948,2026-02-09,Paid,Skill assume cause person fish good pay.
2366,2600,921,2025-07-07,Pending,So eight office decide relate course.
2367,2601,4741,2025-11-01,Overdue,Detail education them general center management answer.
2368,2602,1234,2025-10-05,Pending,Near military political serious industry late.
2369,2603,4506,2026-02-20,Paid,Road bring quality key radio picture.
2370,2604,2118,2026-01-22,Paid,Man campaign task evidence check against.
2371,2605,3535,2025-09-18,Overdue,Grow religious theory or learn raise fast worry.
2372,2606,3661,2025-12-16,Paid,Pattern none arrive.
2373,2607,2389,2025-08-06,Paid,Kind role behind report.
2374,2608,1590,2025-06-02,Paid,Finally green our different actually.
2375,2609,882,2026-02-12,Paid,Summer light stuff use.
2376,2611,255,2025-12-22,Paid,Before enter bank show research.
2377,2612,384,2025-10-17,Pending,Last whom data ask.
2378,2613,2506,2025-12-21,Paid,Ever building sea no like.
2379,2614,4955,2025-09-23,Paid,Decide people green high.
2380,2615,4048,2026-02-23,Pending,American star relationship keep.
2381,2617,1482,2025-09-25,Paid,Manage yard various.
2382,2618,414,2025-09-25,Paid,Glass result thus.
2383,2619,4476,2025-12-04,Paid,Yes voice if church take almost.
2384,2620,2954,2025-10-24,Pending,Until take interesting adult.
2385,2621,4428,2025-08-28,Paid,Interest ability huge worry.
2386,2622,4572,2025-12-27,Paid,Manage official add hope west improve single.
2387,2623,1015,2025-11-19,Paid,Shake choose network business I stage buy figure.
2388,2624,1859,2026-01-02,Paid,Woman player writer probably car lose.
2389,2625,4133,2025-11-07,Paid,Have new information race threat put test.
2390,2626,668,2026-01-20,Paid,Old level agree leg size none.
2391,2627,4201,2025-07-16,Paid,Woman six few partner meet true price.
2392,2628,4594,2025-12-12,Paid,Effort middle career administration.
2393,2629,2041,2025-12-15,Paid,Should challenge town politics project.
2394,2630,625,2025-06-24,Paid,Institution friend big medical.
2395,2631,4386,2025-05-29,Pending,Southern suddenly wear seat.
2396,2632,191,2025-11-05,Paid,Off staff capital method interview off.
2397,2633,2702,2025-12-19,Paid,Way she only one film which town should.
2398,2634,3063,2025-09-20,Paid,Computer when finish.
2399,2636,2281,2026-01-07,Paid,Program concern lay keep as.
2400,2638,4315,2025-07-23,Paid,Treatment under shake cell me speak contain old.
2401,2639,1244,2026-02-07,Overdue,Culture successful fly you camera plan.
2402,2640,1357,2026-02-24,Pending,Your various evidence road.
2403,2641,1567,2025-12-31,Pending,Back appear there.
2404,2642,3167,2025-08-10,Pending,Any hundred east summer board.
2405,2643,4367,2025-12-22,Pending,Big budget water find.
2406,2644,749,2025-10-25,Paid,Left month trade decide friend find century.
2407,2645,2313,2026-02-17,Paid,Key poor amount line within image.
2408,2646,1932,2025-12-11,Paid,Care house goal official.
2409,2647,1136,2026-02-19,Paid,Response foreign pattern list.
2410,2648,3171,2026-02-04,Paid,Few federal cell operation.
2411,2649,694,2025-12-25,Paid,Her you full knowledge another total.
2412,2650,4992,2026-01-10,Paid,Time field most enjoy conference history pass once.
2413,2651,2686,2026-01-18,Paid,Tv standard democratic rather side involve.
2414,2652,4023,2025-07-15,Pending,Any always around.
2415,2653,4431,2026-01-14,Paid,Base sound notice heart accept seem.
2416,2654,229,2025-11-08,Pending,Research deal be day.
2417,2655,3747,2025-10-14,Pending,Sport rather major remain process hear strategy.
2418,2657,4399,2026-01-30,Pending,World lead small enjoy high act.
2419,2658,505,2025-08-15,Paid,Available support under day mission article.
2420,2659,3608,2025-12-02,Pending,Voice determine report structure my partner.
2421,2660,1433,2025-07-21,Pending,New establish sell most story learn rate.
2422,2661,4125,2025-09-12,Pending,Suddenly message trip fast.
2423,2662,1839,2025-08-28,Paid,Central green newspaper leave voice help people ten.
2424,2663,3681,2026-02-06,Paid,Begin light heavy class party view including.
2425,2664,543,2026-02-15,Paid,Question entire simply smile life team.
2426,2665,1379,2025-07-24,Paid,Purpose performance administration with fill.
2427,2667,1751,2026-01-26,Paid,Key realize early order own.
2428,2668,3542,2026-01-07,Paid,Join against generation across else.
2429,2669,3018,2026-02-24,Pending,Cell author business leader have real care.
2430,2670,2102,2025-04-12,Pending,Cause decide become water clear evening.
2431,2671,3350,2025-11-10,Paid,Year at its economic nature catch TV.
2432,2672,1903,2025-08-10,Paid,Paper night method pick PM people.
2433,2673,3145,2025-07-08,Paid,Per current your there story.
2434,2674,4442,2025-05-01,Paid,Church American similar new probably life exactly research.
2435,2675,236,2025-11-28,Overdue,Worry woman example seven morning range another.
2436,2676,1960,2026-01-21,Paid,Reveal practice federal life turn.
2437,2677,3548,2025-10-17,Paid,Husband history far wear teacher western issue.
2438,2678,4645,2025-12-10,Pending,Drug away family cold oil hot sister fast.
2439,2679,1402,2026-01-21,Paid,That organization within me seek sport.
2440,2680,376,2026-02-14,Paid,Style hard even analysis attention democratic.
2441,2681,2405,2025-08-14,Overdue,Other style moment be country.
2442,2682,2933,2025-10-26,Overdue,Woman try safe increase should concern.
2443,2683,465,2025-07-21,Paid,Career general art standard participant debate theory.
2444,2684,1301,2025-07-25,Pending,Republican others hour before become determine factor fight.
2445,2685,3865,2026-02-03,Paid,Miss yeah compare tell statement their scene especially.
2446,2686,420,2025-08-12,Pending,Activity successful east friend program large there.
2447,2687,945,2025-10-31,Paid,Believe art lot appear have church body bed.
2448,2688,3240,2026-02-16,Paid,Attention day public market.
2449,2689,2294,2025-11-28,Paid,All gun Republican pressure social hair.
2450,2690,1175,2025-11-02,Paid,Develop course own bad course national piece out.
2451,2691,3262,2025-08-10,Paid,Bed population national others college true wife.
2452,2692,1455,2025-07-28,Paid,Child information his contain act wonder dinner read.
2453,2694,1004,2025-11-02,Overdue,Ball around behind hand.
2454,2695,1944,2025-08-25,Pending,Carry participant out south.
2455,2696,358,2025-10-27,Paid,Occur Congress boy act reason film bank.
2456,2697,4699,2026-01-11,Paid,Season report management item score agreement.
2457,2698,4481,2025-09-25,Pending,Heart policy eye probably consumer eat.
2458,2699,4278,2026-02-04,Paid,Difficult much about he.
2459,2700,2971,2025-11-09,Paid,Control price right fund wife bit bar hold.
2460,2701,3730,2026-01-28,Paid,Series performance wind term my fast.
2461,2702,1778,2026-02-11,Paid,Own group authority Republican.
2462,2703,240,2026-01-09,Paid,Avoid pretty just process expert suggest.
2463,2704,4338,2026-02-04,Paid,Offer including rule resource.
2464,2705,417,2026-01-24,Paid,Third work eye agree court science next.
2465,2707,3178,2026-02-06,Pending,Six Mr in account sometimes turn.
2466,2708,3846,2025-11-28,Paid,Send miss five more perform feeling.
2467,2709,3965,2026-01-03,Paid,Across conference management fact turn.
2468,2710,2228,2026-02-10,Paid,Wait consumer current look cover increase trip.
2469,2711,4402,2025-02-18,Paid,There project increase teacher reveal save more.
2470,2712,4233,2026-02-22,Pending,That apply personal show start end.
2471,2714,2110,2025-04-16,Paid,Increase outside difference heavy.
2472,2715,4382,2025-11-20,Paid,Save each else inside mention tough.
2473,2716,426,2025-09-24,Overdue,Huge book management gas for amount education difference.
2474,2717,4865,2025-11-20,Paid,Data lawyer own pretty large memory term.
2475,2718,472,2025-12-13,Paid,Culture Congress east little subject.
2476,2719,2809,2026-01-26,Paid,Pass child none street trade ready so.
2477,2720,4612,2025-12-02,Paid,Foot wide attorney feeling message.
2478,2721,4912,2025-07-26,Pending,Find seem game year.
2479,2722,3585,2026-01-29,Paid,Bad begin both large.
2480,2723,336,2025-09-05,Paid,President once available light move bit fire.
2481,2724,4750,2025-11-27,Overdue,Easy create or same.
2482,2725,415,2025-09-01,Paid,Build strategy mean throughout.
2483,2726,4638,2025-10-25,Pending,Hundred law international seat.
2484,2727,1278,2025-04-21,Paid,Anyone political produce consider thus local according.
2485,2728,3386,2026-01-02,Paid,Chair whatever financial employee nearly speak.
2486,2729,2426,2026-01-05,Paid,Example notice that class education painting chance somebody.
2487,2731,653,2025-11-17,Paid,Word actually remember control.
2488,2732,3355,2025-06-18,Paid,Themselves wide PM focus you the recognize.
2489,2733,1452,2025-11-22,Paid,Thank model president realize indicate significant.
2490,2734,743,2026-02-08,Paid,Third player as meet six area along task.
2491,2735,3395,2025-05-20,Paid,Those quite everybody real single husband make.
2492,2736,506,2025-09-30,Paid,Take ok room sure director order.
2493,2737,1416,2026-01-16,Paid,Live development cost important machine soldier again.
2494,2738,2018,2026-01-24,Paid,Simply tree unit weight everybody for.
2495,2739,3470,2025-11-22,Paid,Down hope prove actually few guess PM.
2496,2740,1265,2026-01-28,Paid,Parent student couple.
2497,2741,1966,2025-12-14,Paid,Imagine common staff knowledge.
2498,2742,2186,2025-12-13,Paid,Face event firm window attention.
2499,2743,647,2025-08-01,Pending,Technology hundred near forget six artist.
2500,2744,4532,2025-07-19,Paid,Chance wind great phone picture clearly mother then.
2501,2745,4060,2025-10-29,Paid,Deep both doctor deep lose.
2502,2746,1879,2025-12-25,Paid,Become drop down knowledge seek father threat possible.
2503,2747,961,2025-09-27,Paid,Blood science really always continue.
2504,2748,3076,2025-07-26,Paid,Someone after throughout party read.
2505,2749,1549,2026-01-21,Paid,Send total almost.
2506,2751,1959,2026-01-26,Paid,Range to partner human thus enjoy write.
2507,2752,1475,2025-06-07,Paid,Moment word born southern information.
2508,2753,1143,2025-10-20,Pending,Quality individual girl parent.
2509,2754,3280,2026-01-15,Pending,By put hit.
2510,2755,2824,2026-02-19,Paid,Participant sort may any result.
2511,2756,4442,2025-10-28,Pending,Chance listen red focus participant.
2512,2759,3054,2026-02-19,Paid,Bed officer truth question response.
2513,2760,3933,2025-12-19,Paid,Common any stop rather movement popular half.
2514,2761,4015,2025-12-27,Paid,Yeah product fine shoulder never place.
2515,2762,4111,2026-02-15,Pending,Sport smile on task tend.
2516,2763,4093,2025-12-17,Paid,Born change data return hard all animal spend.
2517,2764,2972,2025-08-17,Paid,There house similar his civil.
2518,2765,544,2025-03-16,Paid,Establish want soldier perhaps material expect.
2519,2766,2699,2025-08-08,Pending,Student down affect night deal certain matter.
2520,2767,2524,2026-01-25,Paid,Tv I try food task.
2521,2768,2595,2025-12-05,Pending,Site Mr him growth everybody.
2522,2769,4164,2025-09-16,Paid,Stay capital hot.
2523,2770,2046,2026-01-06,Pending,Debate mention paper pull in focus season.
2524,2771,1303,2026-01-15,Pending,Sister forget artist meet.
2525,2772,1714,2025-12-09,Paid,Open area practice whom trouble.
2526,2773,202,2025-06-04,Pending,Best better true beautiful.
2527,2775,3300,2026-01-26,Paid,Least yet however top.
2528,2776,2601,2025-07-02,Paid,Subject box so seem.
2529,2777,2542,2025-05-24,Paid,Early store discuss ready reason total position.
2530,2778,4269,2026-02-04,Paid,Though where along fast play data eye woman.
2531,2779,2567,2026-01-14,Paid,Trouble machine money necessary them who would what.
2532,2780,916,2025-06-04,Overdue,Partner so ability word available democratic.
2533,2781,866,2025-06-20,Paid,Career your performance audience positive home.
2534,2782,2765,2025-11-19,Paid,Billion anything card.
2535,2783,832,2026-02-08,Pending,Meeting turn current present wide town.
2536,2784,2005,2026-02-01,Paid,Produce usually north dinner heavy fear piece sense.
2537,2785,4215,2025-11-13,Paid,Couple leader she success final.
2538,2786,438,2025-12-15,Paid,Another house kind bar those indicate also.
2539,2787,4389,2026-01-25,Paid,There by include back choice blood test building.
2540,2788,193,2026-01-30,Paid,Learn occur after race nature.
2541,2789,4466,2026-01-31,Paid,Art improve water service.
2542,2790,3880,2026-02-19,Pending,Attack live administration remember such.
2543,2791,3232,2025-11-29,Paid,Within information rather method nation company finish.
2544,2792,2924,2025-06-11,Overdue,What set Republican manager attorney.
2545,2793,1354,2026-02-08,Paid,Building region fly bill.
2546,2794,631,2026-02-09,Pending,Would author town debate natural.
2547,2795,4313,2025-11-27,Paid,Situation new more.
2548,2796,3805,2025-09-04,Paid,Key discussion trip town large stock.
2549,2797,846,2025-10-08,Paid,Since its argue card modern director.
2550,2798,651,2026-02-04,Paid,Study fact keep why PM.
2551,2799,3598,2025-11-27,Pending,Allow red continue rock.
2552,2800,1466,2025-08-27,Overdue,Heavy citizen half event.
2553,2802,3580,2026-01-22,Paid,Almost become will house.
2554,2803,2214,2025-07-16,Paid,White see music site space church.
2555,2805,2583,2026-02-11,Pending,Father agree physical present world become reflect.
2556,2806,2023,2026-01-17,Paid,Avoid eat Mr professor see.
2557,2807,1713,2025-11-01,Paid,Office charge field fight avoid simply.
2558,2809,4915,2026-02-19,Paid,Quickly trip design life.
2559,2810,524,2026-01-25,Paid,Read around less some.
2560,2811,1472,2025-05-16,Paid,Safe step pay large.
2561,2812,4895,2025-08-25,Overdue,Cover accept civil then expert need.
2562,2813,4353,2025-08-18,Paid,Age other whose begin receive.
2563,2814,2852,2025-11-14,Pending,Sometimes allow hair drug difference.
2564,2815,4433,2026-01-31,Paid,Bring effect live appear seat executive.
2565,2816,3704,2026-02-05,Paid,Visit whose sing north produce both people.
2566,2817,2676,2025-05-25,Pending,Cup foot always dream.
2567,2818,4060,2026-01-18,Paid,Range production strategy.
2568,2819,592,2025-07-09,Paid,Finally draw community perhaps sea fight.
2569,2820,1271,2026-02-10,Paid,Or since crime main back image.
2570,2821,992,2026-02-06,Paid,By do until image.
2571,2822,3922,2026-01-16,Pending,Others whole development central ready finally body arm.
2572,2823,620,2025-11-06,Paid,Receive rule specific almost road mouth.
2573,2824,1499,2026-01-02,Paid,Involve responsibility consider.
2574,2825,2079,2025-07-09,Pending,Quickly apply only another.
2575,2826,1742,2025-03-27,Overdue,Low unit learn table.
2576,2828,3519,2026-02-13,Paid,Crime cause art leg source.
2577,2829,4969,2026-02-13,Pending,Market event discuss great positive.
2578,2830,3367,2025-09-19,Paid,Arm vote ok always type value.
2579,2831,4430,2026-01-30,Paid,Place finish street floor these house job.
2580,2832,2214,2026-02-22,Paid,Budget song receive almost offer center training with.
2581,2833,607,2025-12-27,Pending,Follow million thought themselves.
2582,2835,3179,2025-12-14,Paid,Field change hair middle out reduce kid.
2583,2836,2555,2026-01-25,Paid,Need else room make.
2584,2837,3746,2025-06-11,Overdue,Short career crime others main collection.
2585,2838,1772,2026-01-16,Pending,Course should occur machine author.
2586,2839,2056,2025-10-09,Paid,Seven benefit pay suffer despite hospital hospital know.
2587,2840,1268,2025-12-23,Paid,Amount sing how article page.
2588,2841,1020,2026-02-20,Paid,Nice same glass foot your special.
2589,2842,4279,2026-02-04,Paid,Apply bit together notice event task.
2590,2844,1131,2025-10-27,Paid,Buy hair spring their next could.
2591,2845,3336,2025-12-13,Pending,Drug order minute involve rock mission run.
2592,2846,606,2025-09-01,Paid,Great state open growth they unit consumer about.
2593,2847,2503,2026-01-25,Overdue,Bag blue activity stuff choice wish.
2594,2848,661,2026-02-06,Paid,Sell day development student dark whole toward former.
2595,2849,4566,2025-12-21,Paid,Down college perhaps range family.
2596,2850,2076,2026-01-21,Paid,Line item room performance recently who degree.
2597,2851,3269,2026-02-21,Pending,Eye miss his participant pass.
2598,2852,4850,2025-11-28,Paid,Drop manage people know poor alone.
2599,2853,1282,2026-02-19,Overdue,Dog other subject three.
2600,2854,3283,2025-12-28,Paid,Ground interesting we amount almost red.
2601,2855,3550,2025-07-08,Paid,Others style drug billion pass tax career.
2602,2857,1958,2025-11-04,Paid,Type technology history dream skill.
2603,2858,4821,2026-01-27,Overdue,Leave administration trouble actually.
2604,2859,4685,2025-11-06,Paid,Along place north.
2605,2860,3307,2025-10-11,Paid,Sing action nature seven red.
2606,2861,152,2026-02-08,Pending,Pattern light evening technology young fight second.
2607,2862,886,2025-11-30,Pending,Beyond summer prevent fly.
2608,2863,1984,2026-02-11,Pending,Own nor feel people age.
2609,2864,4551,2025-12-08,Pending,Address mind near heart.
2610,2866,1758,2025-11-14,Paid,Answer in large degree cost could start.
2611,2867,2246,2025-12-06,Paid,Management me lot she.
2612,2868,3991,2025-08-28,Pending,Direction able indicate blood next.
2613,2869,197,2026-02-21,Paid,Federal else return force above specific face.
2614,2871,3014,2025-06-03,Paid,Either sense item song night already.
2615,2872,1408,2025-12-05,Paid,If likely south.
2616,2873,1355,2026-02-06,Pending,Deal rather find present present director difference.
2617,2874,1071,2025-06-05,Pending,Back school attention wait modern do.
2618,2876,3542,2025-08-04,Paid,Safe cell act parent fly understand eight.
2619,2877,1618,2026-02-24,Paid,Star these simply.
2620,2879,1795,2026-01-28,Paid,Hotel run level team natural help involve.
2621,2880,2977,2025-09-12,Pending,Indicate grow discover study throw.
2622,2881,2739,2025-11-19,Paid,Often could gas campaign name education for.
2623,2882,482,2026-02-10,Paid,Film student its movie they view.
2624,2883,2479,2026-02-24,Paid,Chance daughter nice certainly among.
2625,2884,2190,2026-02-14,Paid,Real data thing.
2626,2886,534,2026-01-22,Paid,The many receive behind treat wonder.
2627,2887,389,2026-02-24,Paid,Fight son staff put you question.
2628,2888,3786,2026-02-09,Paid,Special six activity either adult.
2629,2890,1852,2025-05-09,Paid,Site American stop factor which former model.
2630,2891,4160,2025-10-06,Paid,Argue left senior material prove beat great.
2631,2892,3188,2025-08-16,Paid,Quickly training end wear.
2632,2893,1925,2025-09-09,Paid,Begin character simply teacher already.
2633,2895,1839,2025-11-11,Paid,Imagine project thought daughter enter far everyone.
2634,2896,1582,2025-09-30,Overdue,Reach so apply so.
2635,2897,2166,2026-01-17,Paid,Food campaign computer in just your join.
2636,2898,4194,2026-02-23,Paid,None sport threat.
2637,2899,4608,2026-02-02,Paid,No three player memory although.
2638,2900,2441,2025-12-15,Paid,Election into maintain lawyer example both coach.
2639,2901,2230,2025-12-07,Paid,Standard once continue role really fire address.
2640,2902,3824,2026-02-20,Paid,Control whose scene attack well everything.
2641,2903,4405,2026-02-22,Paid,Civil community much choose provide little.
2642,2905,3043,2026-02-14,Pending,Sell decide really fine generation ten.
2643,2906,2397,2026-02-20,Paid,Appear arrive fight least.
2644,2907,2881,2026-01-13,Pending,For discover collection skin these.
2645,2908,476,2026-02-23,Pending,Data relationship role lot young firm represent.
2646,2909,4759,2025-11-12,Overdue,Bill minute care need without arm level.
2647,2911,227,2025-03-30,Paid,Election choose last another public beautiful.
2648,2912,4044,2026-02-07,Paid,Issue approach describe wall cut smile sing.
2649,2913,2754,2025-06-09,Paid,Response eat win me system them by.
2650,2914,1418,2025-07-27,Paid,Air total adult election.
2651,2915,1690,2025-08-07,Paid,The Democrat everyone maintain.
2652,2916,2446,2025-08-06,Paid,Garden soon tax bit boy report.
2653,2917,547,2025-07-26,Paid,Include boy become admit religious.
2654,2919,1799,2025-12-31,Paid,Fight evidence local responsibility source.
2655,2920,4656,2026-01-23,Pending,Ahead force young itself pull main.
2656,2921,877,2026-02-23,Paid,Another we consumer source main.
2657,2922,4566,2025-11-27,Paid,Worry authority adult work protect far.
2658,2923,2711,2025-10-07,Paid,Campaign tonight everybody.
2659,2924,1755,2025-08-23,Paid,Good reflect worker stand resource skin vote loss.
2660,2925,733,2025-03-13,Overdue,High life set test.
2661,2926,4100,2026-02-07,Pending,Individual green physical amount.
2662,2927,2944,2026-02-03,Pending,Agreement up indicate hear body.
2663,2928,4225,2025-11-15,Paid,Be save feeling wife east direction.
2664,2929,4627,2026-02-13,Paid,Administration also should answer window soon.
2665,2930,1646,2025-12-20,Paid,Pattern support member rest its painting.
2666,2931,4624,2025-05-31,Pending,Tax central him door drive.
2667,2932,139,2025-11-17,Pending,Soldier yet right control fund long church each.
2668,2933,626,2025-04-19,Paid,Wind wonder kid cold drop agency fear will.
2669,2934,566,2025-04-18,Paid,Step study far herself policy experience station.
2670,2935,3962,2026-02-01,Paid,Listen concern she team current probably north.
2671,2936,2891,2025-07-24,Pending,Think apply toward state.
2672,2937,2926,2026-02-16,Paid,Eight assume trip.
2673,2938,2751,2025-10-17,Paid,Defense every physical magazine others check look large.
