invoice_id,job_id,invoice_amount,invoice_date,payment_status,invoice_notes
6454,7113,4956,2025-09-03,Paid,Strategy live responsibility cold force agree surface.
6455,7114,2732,2025-02-07,Paid,Could commercial rest small role.
6456,7115,3740,2025-10-20,Paid,Yes return sister year politics thousand.
6457,7116,4428,2025-10-21,Paid,Couple drive help hope will.
6458,7117,1373,2025-11-29,Paid,Phone local father budget.
6459,7118,3295,2026-01-11,Paid,Want start trial pass.
6460,7119,3309,2025-11-19,Paid,Worker general heavy whole.
6461,7120,2087,2025-12-16,Overdue,Then break tonight fall town.
6462,7121,1088,2025-10-01,Pending,Probably economic billion usually.
6463,7122,122,2025-10-05,Pending,Lawyer amount your apply others on reach.
6464,7123,3786,2025-05-31,Paid,Thing table environmental might likely central capital.
6465,7125,3026,2025-11-12,Pending,Represent office size teach young ball move.
6466,7126,3511,2025-07-06,Pending,Way institution or throughout.
6467,7127,3002,2025-05-19,Pending,Part reason past.
6468,7128,2359,2025-05-29,Paid,Each where style cup sell capital role.
6469,7129,2568,2025-12-17,Pending,Summer want ten face phone.
6470,7130,4190,2026-02-07,Paid,Catch summer financial.
6471,7131,3664,2025-11-26,Paid,Term determine wall floor argue particular.
6472,7132,915,2025-09-17,Paid,Responsibility some lawyer teacher PM.
6473,7133,3722,2025-07-30,Paid,Music visit speak safe.
6474,7135,2878,2025-12-10,Paid,Lead challenge ability.
6475,7136,1948,2026-01-07,Paid,Information us left time ago.
6476,7137,506,2025-12-08,Paid,Study for option letter security.
6477,7139,1711,2025-05-29,Paid,Sure street night behavior.
6478,7140,3166,2025-12-27,Paid,That share hot allow rest painting up.
6479,7141,3462,2025-04-16,Pending,None next well anything.
6480,7142,147,2025-07-23,Paid,Management as interest method.
6481,7143,1529,2026-02-13,Paid,Low student among drug.
6482,7145,1559,2025-09-10,Paid,Want generation black part.
6483,7146,3752,2025-10-07,Pending,Call memory film our test everybody.
6484,7147,3264,2025-12-16,Paid,On ten lay so.
6485,7148,4903,2026-01-12,Overdue,Way though system especially.
6486,7149,188,2026-02-19,Pending,Difference north current wife management.
6487,7150,549,2026-01-19,Paid,Take above whom society occur argue.
6488,7151,2065,2025-12-29,Paid,Else energy late remember cold could season.
6489,7153,161,2025-11-12,Pending,Campaign rate return all.
6490,7154,1925,2026-02-21,Paid,Author than poor six wish teach sense.
6491,7155,4975,2025-05-09,Pending,Condition reveal trip certainly eight subject season.
6492,7156,3658,2025-10-07,Overdue,Dog such before particular.
6493,7157,817,2026-02-16,Paid,Debate dark care life business.
6494,7158,2477,2026-02-21,Paid,Store member most central really however.
6495,7159,3517,2026-02-09,Overdue,Talk state skill magazine fact.
6496,7160,4349,2026-01-08,Paid,Contain friend care success side.
6497,7161,4070,2025-08-12,Paid,Challenge lose make mind.
6498,7162,2742,2025-02-28,Pending,Spend without participant everything authority future hot in.
6499,7163,3565,2025-07-23,Paid,Science everything hundred difficult this game remain cold.
6500,7165,3100,2026-01-29,Paid,Road quickly possible determine.
6501,7166,1282,2025-04-26,Paid,Economic every official red left partner.
6502,7167,2805,2025-06-16,Paid,Religious life exist ask different write table.
6503,7168,1724,2025-12-28,Overdue,So beautiful enjoy before.
6504,7169,1840,2025-11-22,Pending,Tree that in play forget itself go.
6505,7171,1101,2025-10-16,Paid,Listen vote business arrive write be they challenge.
6506,7172,2375,2025-06-06,Overdue,Place yourself southern young skin.
6507,7174,661,2025-12-03,Paid,Series new perform mission foot question commercial.
6508,7175,371,2025-09-24,Paid,Personal finish buy receive.
6509,7176,348,2026-02-08,Paid,Appear figure be herself some management.
6510,7177,234,2026-01-02,Paid,Use rich pay sea debate well.
6511,7178,1755,2026-01-08,Paid,Newspaper father somebody second by must benefit.
6512,7179,2867,2025-03-11,Paid,Challenge brother discuss hard great.
6513,7180,3705,2026-01-21,Paid,Approach people here future career explain because.
6514,7181,4873,2025-10-27,Paid,Cup painting into subject environment.
6515,7182,4616,2025-09-25,Pending,Agree forget argue administration today tell child avoid.
6516,7183,432,2025-06-20,Paid,Inside in debate man campaign least.
6517,7184,818,2025-03-05,Paid,Vote article dream front indicate.
6518,7185,4322,2026-01-04,Paid,Interesting official financial term sell citizen add truth.
6519,7186,532,2026-02-23,Pending,Give thought may phone really church tax.
6520,7187,1480,2026-02-21,Pending,Style any point cover letter before fish.
6521,7188,3072,2025-10-20,Overdue,White anything offer benefit likely.
6522,7189,1371,2026-01-21,Paid,Sister bill hold dog many thought.
6523,7190,4767,2025-12-18,Paid,Deep majority summer.
6524,7191,667,2025-12-01,Overdue,Discover pull clearly southern center budget.
6525,7192,965,2026-01-26,Paid,Example party write conference his system skin.
6526,7193,3414,2025-11-01,Pending,Early upon must consumer.
6527,7194,3471,2025-12-25,Paid,Later consider knowledge recognize.
6528,7195,2049,2025-08-14,Paid,Feeling identify public court.
6529,7196,512,2026-02-02,Paid,Senior president be.
6530,7197,3906,2025-06-14,Overdue,Television past term Democrat.
6531,7198,1048,2025-12-07,Paid,Day marriage executive strategy off head happy risk.
6532,7199,3711,2025-12-29,Paid,Watch anyone fine leg main inside.
6533,7201,1003,2025-12-26,Paid,Miss region others.
6534,7202,2774,2025-12-08,Overdue,Probably shoulder reflect possible.
6535,7203,4776,2026-02-03,Paid,Central collection speech out price face range.
6536,7204,712,2025-07-20,Paid,Rise maintain particular edge.
6537,7205,4527,2026-02-09,Paid,This wall break.
6538,7206,3143,2026-01-10,Paid,Other decision physical thing page.
6539,7207,4684,2026-01-18,Pending,Behind culture far truth commercial cause green.
6540,7208,4317,2026-01-25,Paid,Floor catch everything.
6541,7209,1763,2025-08-21,Paid,Strong front choose shake successful the president.
6542,7210,4870,2026-01-26,Overdue,Me pick administration bad stock.
6543,7212,1347,2026-02-21,Paid,Social ask sit ok marriage help.
6544,7213,4878,2025-08-27,Paid,Often coach result policy subject work.
6545,7214,3496,2026-02-23,Pending,Green possible both week offer wall support unit.
6546,7215,4770,2025-07-05,Paid,Dark million claim culture strong.
6547,7216,3318,2026-01-31,Paid,Trouble art option smile past whether.
6548,7217,2213,2026-01-28,Pending,Improve young late character leader.
6549,7218,3427,2025-12-03,Paid,Hospital total single law left.
6550,7219,2752,2026-02-02,Paid,Week through history your analysis husband expert.
6551,7222,1630,2025-06-04,Paid,Mission light order themselves fill course identify.
6552,7223,2143,2025-05-14,Paid,Member eat week western church bill pull.
6553,7224,3146,2025-11-15,Paid,Shake capital ready strong day.
6554,7225,2660,2026-02-20,Paid,Section result town two past almost.
6555,7226,153,2026-02-19,Paid,Later visit plant public tell become.
6556,7227,4942,2026-01-17,Paid,Information enjoy fly.
6557,7229,4101,2026-02-15,Paid,Senior dog bring world current physical.
6558,7230,662,2026-02-21,Paid,Finally usually hundred fund sense catch.
6559,7231,806,2026-01-05,Paid,Bit let case civil town tough.
6560,7232,1019,2025-11-24,Paid,Though left knowledge operation last study federal work.
6561,7233,4299,2025-03-23,Pending,Kid between not instead base.
6562,7234,384,2025-08-11,Paid,Table first less section.
6563,7235,1019,2025-10-18,Paid,Challenge money so contain.
6564,7236,154,2025-06-15,Paid,Begin likely set green industry source.
6565,7237,2068,2026-01-04,Paid,First minute sit man score turn.
6566,7238,4185,2025-10-31,Paid,Commercial never recently wonder city.
6567,7239,1083,2026-02-04,Paid,Which laugh could yard.
6568,7241,2088,2026-02-02,Overdue,Town either right national old.
6569,7242,2406,2026-01-25,Pending,Leg part drive yourself.
6570,7243,1572,2025-06-07,Paid,Question my prevent meeting.
6571,7244,2033,2026-01-04,Pending,Plant staff book your individual black work.
6572,7246,4428,2025-09-03,Overdue,Low different feel reality senior whole.
6573,7247,4601,2025-11-17,Paid,Instead message stuff parent.
6574,7249,1272,2026-02-15,Pending,Major despite old.
6575,7250,4914,2025-07-17,Paid,Play find close wish PM move.
6576,7252,5011,2025-10-06,Paid,Indeed quickly always bring.
6577,7253,4204,2025-09-17,Paid,Prevent wife sign although drive meet.
6578,7254,863,2025-09-23,Paid,Become maintain state deal why machine.
6579,7256,4671,2026-02-10,Paid,Hold put effect staff very.
6580,7257,991,2026-02-23,Paid,Where buy inside until fall.
6581,7259,1783,2026-02-12,Paid,Pay study out garden owner.
6582,7260,453,2026-01-15,Pending,Coach near natural letter part sure himself.
6583,7261,1229,2026-02-18,Paid,Support consumer happen daughter land generation.
6584,7262,1128,2025-10-12,Pending,Foot make realize also.
6585,7263,2098,2026-01-28,Pending,Put son various agree wear pressure home.
6586,7264,215,2025-11-04,Paid,Far small page wife.
6587,7265,2778,2026-01-21,Paid,Focus leg consumer future student ok among.
6588,7266,2473,2025-10-30,Pending,Doctor different another treat time character body.
6589,7267,2291,2025-09-04,Paid,Avoid anyone trade candidate sit.
6590,7268,1077,2025-08-26,Pending,Every floor machine all leader indeed.
6591,7269,1940,2025-03-01,Paid,Indicate able him still catch cup.
6592,7270,555,2025-09-06,Paid,Country almost accept newspaper night political have everything.
6593,7271,4989,2025-09-15,Paid,Foreign raise take culture window defense.
6594,7272,210,2026-02-13,Paid,Operation subject hour record stock girl onto.
6595,7273,878,2026-02-21,Paid,Theory center and technology room account today center.
6596,7274,847,2025-08-25,Paid,Common have program.
6597,7275,107,2025-05-19,Overdue,Help summer generation.
6598,7276,4864,2026-02-08,Pending,Democratic good think.
6599,7277,3118,2025-11-28,Pending,Here air concern million main politics scene.
6600,7278,209,2026-02-14,Paid,She happen reveal your career modern theory on.
6601,7279,4295,2025-12-02,Paid,Understand like explain mind film save blood.
6602,7280,3394,2026-02-08,Overdue,Day spring during leave those beyond.
6603,7281,4884,2025-08-04,Pending,Window difficult show work reach.
6604,7282,1340,2025-03-12,Paid,Job significant news note vote around.
6605,7283,2679,2025-02-15,Paid,Trial fine billion often.
6606,7284,2228,2025-08-05,Overdue,Pressure feel weight we lead forward here.
6607,7285,897,2025-11-18,Paid,Walk baby after year state tend.
6608,7286,2131,2025-12-26,Overdue,Message purpose effort security kitchen week would.
6609,7287,1398,2026-02-12,Overdue,Develop sound child wife relate course.
6610,7288,766,2025-11-03,Pending,Media eight develop leader body imagine condition quite.
6611,7289,2447,2026-01-02,Paid,Sound discussion effort rich make hear.
6612,7290,4536,2025-09-29,Paid,Third growth black building represent he.
6613,7291,4363,2025-12-30,Paid,Catch join though.
6614,7292,3177,2026-02-23,Paid,Outside indeed bad role century baby fund.
6615,7293,4719,2025-06-01,Pending,News just most before.
6616,7294,248,2025-12-05,Pending,Of risk serious customer.
6617,7295,3632,2026-02-15,Paid,Mind visit available.
6618,7296,2597,2025-07-03,Paid,Some leader goal several nice project.
6619,7297,607,2026-01-07,Paid,Mention lawyer what painting.
6620,7298,2551,2025-11-21,Overdue,Shake speech memory true maybe international machine.
6621,7299,482,2026-02-18,Paid,Boy store science often.
6622,7300,126,2026-02-19,Paid,Prepare read mother model audience line.
6623,7301,3547,2026-02-14,Paid,Very health affect customer magazine.
6624,7302,4887,2026-02-12,Paid,Necessary dream husband nice care attention.
6625,7303,997,2026-01-16,Paid,Test somebody notice area.
6626,7304,465,2025-09-21,Paid,Want security western entire writer issue.
6627,7306,467,2025-10-13,Paid,Fall hotel level expert effect.
6628,7307,4923,2026-01-07,Paid,Address garden can billion knowledge involve.
6629,7308,2091,2025-11-13,Paid,Read seem group.
6630,7309,3888,2025-11-03,Paid,Score side piece pretty.
6631,7310,1856,2026-02-24,Pending,Hold stay drug black strategy seek hold bad.
6632,7311,2675,2026-02-09,Pending,Amount traditional news set benefit bring keep.
6633,7312,4904,2025-10-06,Pending,In everything Mr final listen.
6634,7313,4867,2025-09-08,Paid,Professional light instead son.
6635,7314,4570,2025-02-12,Paid,Whom probably important north grow shoulder when.
6636,7315,4810,2025-06-02,Paid,Or likely firm.
6637,7316,4422,2025-06-29,Paid,Group necessary live white me during mission.
6638,7317,1869,2025-12-15,Pending,Nice reveal according should citizen in.
6639,7318,3312,2025-11-05,Paid,Likely point who success.
6640,7319,1216,2025-10-04,Paid,Reach imagine young require security let thousand PM.
6641,7320,1459,2025-10-06,Paid,President able environmental thus finally public.
6642,7321,1336,2025-10-06,Paid,Issue meet site one reduce government interesting course.
6643,7322,4143,2025-09-22,Paid,Response one describe perhaps west.
6644,7323,972,2025-09-14,Paid,Certainly majority create ability voice determine.
6645,7324,2991,2025-11-12,Overdue,Gun home enough east power.
6646,7325,4106,2026-01-25,Paid,Time that whose strong.
6647,7327,2707,2026-01-06,Paid,Raise marriage policy government.
6648,7328,4499,2025-05-15,Paid,Just compare line.
6649,7329,4003,2025-09-01,Pending,Free start note research light.
6650,7330,4080,2025-10-19,Paid,Thank fact majority go.
6651,7332,1834,2025-10-09,Paid,Attorney fact staff them record into.
6652,7333,1487,2026-01-04,Paid,Its according become check fight establish.
6653,7334,2116,2025-12-27,Paid,Sport first either question.
6654,7335,252,2026-01-30,Paid,Floor fine television current hotel watch some.
6655,7337,935,2025-12-10,Paid,Indicate house somebody my toward.
6656,7338,1813,2025-09-21,Paid,Know red enter necessary pick role.
6657,7339,522,2026-02-08,Paid,State drive the.
6658,7340,2431,2025-12-13,Paid,International another prepare very program.
6659,7341,292,2026-01-13,Paid,Nor eat suddenly bar.
6660,7342,2750,2025-12-25,Paid,Anyone war response idea watch per stop.
6661,7344,3239,2026-02-09,Paid,Vote pay capital young.
6662,7345,677,2025-12-10,Paid,Trial herself list treat.
6663,7346,3398,2026-01-27,Overdue,Computer reality play buy Congress.
6664,7347,3613,2025-11-03,Paid,Former top full.
6665,7348,3942,2025-12-15,Pending,Time full picture win.
6666,7349,1452,2026-01-02,Pending,Operation if class college line agreement minute.
6667,7350,1108,2026-01-24,Paid,Direction free crime more later.
6668,7351,3961,2025-11-29,Paid,Live plant test expert.
6669,7352,1519,2026-01-16,Pending,Teacher wrong while have.
6670,7353,665,2025-07-01,Pending,Rock five wait others can new family.
6671,7354,1763,2025-11-05,Paid,Lawyer skin charge face.
6672,7355,3522,2026-01-27,Paid,Somebody because score class watch discover company.
6673,7356,4932,2025-09-17,Paid,Charge score lead court why long event.
6674,7357,2543,2026-02-04,Pending,Country my develop hair.
6675,7358,3281,2025-11-22,Pending,Record sort walk challenge create.
6676,7359,2607,2026-02-21,Overdue,Through newspaper say.
6677,7360,4649,2025-12-21,Paid,Mother party their operation.
6678,7362,3450,2025-11-07,Paid,Against attack mother price.
6679,7363,119,2026-01-09,Paid,Light million assume better approach good.
6680,7364,755,2025-12-27,Pending,Well attack happen themselves.
6681,7365,1327,2025-08-16,Pending,Dinner himself which opportunity mother believe city design.
6682,7367,2527,2025-10-13,Paid,Necessary loss while past test want to research.
6683,7368,3165,2026-02-10,Paid,Suggest so occur PM build off.
6684,7369,2800,2026-01-31,Pending,Development whole song hold college.
6685,7370,2465,2025-12-26,Overdue,Authority player protect agency detail same work special.
6686,7371,3502,2025-06-29,Pending,Break president he individual address water.
6687,7372,4061,2026-01-18,Pending,Strategy employee serve tend.
6688,7373,2835,2025-10-17,Paid,Available wear without industry lose place drug.
6689,7374,3148,2025-12-07,Paid,Court TV others energy rock accept manager goal.
6690,7375,4301,2026-01-15,Pending,Religious under character police piece blood.
6691,7376,1879,2025-02-23,Paid,Imagine southern be actually big include at threat.
6692,7377,913,2026-01-30,Paid,Career staff government professor.
6693,7378,2663,2025-12-11,Paid,Official style truth commercial TV.
6694,7379,1096,2026-01-06,Paid,Environment cell partner owner activity.
6695,7380,4141,2025-07-25,Paid,Dark without usually itself off total chair.
6696,7381,378,2025-08-15,Pending,Economic now hard myself task building test.
6697,7382,3318,2026-02-11,Paid,Type career movement vote find hope pick this.
6698,7383,4162,2026-01-07,Paid,Language reality discuss.
6699,7384,3757,2025-04-06,Paid,With democratic theory billion.
6700,7385,629,2025-09-11,Paid,Network program however government.
6701,7387,1700,2025-07-14,Paid,Price into visit partner fund house often.
6702,7388,2563,2026-01-25,Paid,Plan change defense figure positive smile.
6703,7389,882,2026-02-22,Paid,Talk child next arm degree central mission.
6704,7390,720,2025-12-06,Overdue,Lot challenge election with.
6705,7391,4613,2026-01-08,Paid,System everybody tax week.
6706,7392,3425,2025-11-14,Paid,Model possible power tend represent recent yet.
6707,7395,4620,2026-01-04,Paid,Fact cost alone out.
6708,7396,2988,2025-11-04,Paid,Film big act action answer.
6709,7397,4554,2025-10-29,Pending,Tree expert recently morning.
6710,7398,3314,2026-01-19,Pending,They and international value society food.
6711,7399,4518,2025-12-16,Paid,Than deep call fire.
6712,7400,997,2025-09-19,Paid,Hair structure minute station my.
6713,7401,3520,2025-10-16,Pending,Sister early affect ten.
6714,7402,2831,2025-12-20,Paid,Instead movie test fill science performance ball.
6715,7403,3954,2025-11-14,Paid,Just cultural sit husband participant item.
6716,7404,1248,2025-02-05,Paid,Expert week certainly class.
6717,7405,2201,2025-06-01,Pending,State new shoulder.
6718,7406,1967,2025-09-07,Paid,Picture exactly good yeah pressure.
6719,7407,4778,2025-05-28,Paid,Day attention well keep.
6720,7408,3904,2025-11-29,Paid,Past rather laugh get miss bit enough.
6721,7410,3139,2026-01-20,Paid,Team get play first us visit.
6722,7411,3567,2026-01-05,Paid,Open great whom tonight dream include positive name.
6723,7412,1539,2026-01-13,Paid,Customer discuss only.
6724,7413,2449,2026-01-27,Pending,Establish professor prevent sure a.
6725,7414,4504,2025-11-10,Pending,Home case American data husband.
6726,7416,626,2026-01-25,Paid,Think under with who carry product ten through.
6727,7417,4417,2025-10-26,Overdue,Person why way name low real paper.
6728,7418,475,2025-07-29,Paid,Degree lose but as.
6729,7420,4800,2026-02-20,Paid,Long agent attack citizen camera officer reality first.
6730,7421,3605,2025-10-29,Pending,Her wide trouble whole serve.
6731,7422,470,2025-12-29,Paid,Skin letter health pull really media few different.
6732,7423,4639,2026-02-21,Paid,Suffer travel single friend song company easy.
6733,7424,4759,2025-12-27,Paid,Realize interest plan professional together couple strategy.
6734,7425,2310,2026-01-22,Paid,Piece future either though late trip send.
6735,7426,4558,2025-10-02,Paid,Yeah six hotel apply budget window.
6736,7427,2432,2025-12-19,Paid,Public detail newspaper next.
6737,7428,4138,2026-02-12,Paid,Forward reason yeah central.
6738,7429,490,2025-06-12,Overdue,Light people medical to treat care husband.
6739,7430,3483,2025-11-07,Paid,Time technology realize star usually nature guess.
6740,7431,2582,2025-09-08,Paid,Upon letter several church deal.
6741,7433,2474,2026-01-26,Paid,Left according risk institution mother report above.
6742,7434,3585,2025-09-18,Paid,Ok series few beautiful.
6743,7435,2816,2026-02-05,Pending,Drop man who marriage.
6744,7436,3962,2026-01-25,Pending,Fill the her feel serious those race scientist.
6745,7437,3659,2025-11-09,Paid,Range pay sign wonder.
6746,7438,3533,2026-01-11,Paid,Production we else.
6747,7439,1774,2025-12-29,Paid,Free big production owner.
6748,7442,1634,2025-11-26,Paid,While individual might baby base fish.
6749,7443,3758,2025-12-30,Paid,More leave which morning traditional might never.
6750,7444,2652,2026-01-24,Paid,Figure hot him Democrat against make administration.
6751,7445,2689,2025-10-03,Paid,Newspaper scene could describe growth clear program.
6752,7446,663,2026-02-05,Pending,Bag television down you.
6753,7448,2202,2026-01-18,Pending,Create interest attorney bring.
6754,7449,939,2026-02-09,Pending,Culture admit case page name the beat.
6755,7450,2901,2026-02-07,Paid,Affect she score.
6756,7451,3315,2025-04-06,Overdue,Mouth better significant common think that.
6757,7452,2933,2025-10-09,Paid,Beat arm hope high house last thousand minute.
6758,7453,2730,2025-07-12,Paid,Share tonight difference.
6759,7454,902,2025-04-27,Paid,Civil can sister.
6760,7455,2756,2025-09-03,Paid,Or what go game interview doctor.
6761,7456,3648,2025-06-13,Paid,Around right officer discussion sure.
6762,7457,3688,2025-08-13,Paid,Network environment so effect though.
6763,7458,4407,2025-04-07,Overdue,Surface language ok network somebody blood.
6764,7459,3261,2025-07-12,Paid,He stage daughter view area hard.
6765,7460,635,2025-06-22,Pending,Nothing scene stuff better back well.
6766,7461,3632,2026-01-04,Paid,Career customer husband final body painting material.
6767,7462,3397,2025-12-02,Paid,One new start southern community.
6768,7463,1863,2026-01-23,Pending,Assume town red travel form task yard.
6769,7464,3381,2025-07-17,Paid,Seven exactly up laugh protect.
6770,7465,3587,2026-01-22,Pending,Though fast especially president claim soldier.
6771,7466,814,2026-02-03,Paid,Evidence suffer every until us Mr.
6772,7467,2158,2025-05-24,Paid,Simply sometimes design score rate service suffer.
6773,7468,2219,2026-02-17,Paid,Manage draw age east civil.
6774,7469,1056,2026-01-31,Overdue,Shake along hundred reveal.
6775,7470,4515,2025-11-22,Pending,Account you stand.
6776,7471,2990,2026-02-04,Pending,Rather back everybody.
6777,7472,3274,2025-09-25,Overdue,Agree assume design reduce real wife blue bar.
6778,7473,268,2025-09-19,Paid,Require thought year.
6779,7474,171,2025-10-02,Pending,Our question real son.
6780,7475,1423,2025-12-20,Paid,Operation middle expect significant.
6781,7476,4325,2026-01-15,Pending,Space have pretty accept later.
6782,7477,365,2026-02-08,Paid,Father through maybe whether national what note.
6783,7478,3702,2026-02-01,Paid,Available finish me book.
6784,7479,2603,2026-02-02,Paid,Especially available just stock month.
6785,7480,1755,2026-01-10,Overdue,Lawyer finally class sense join subject.
6786,7481,2664,2025-10-08,Pending,Bit serve really tell foreign consider your sense.
6787,7482,1091,2025-09-28,Paid,Care room painting study study provide.
6788,7483,1766,2026-02-11,Paid,Question development young cell.
6789,7485,2868,2025-07-09,Paid,Do local culture think detail third.
6790,7486,1429,2026-02-13,Pending,Customer cup beat all main admit painting.
6791,7487,1437,2026-02-24,Overdue,Assume however about.
6792,7488,966,2026-01-23,Paid,Rule out shoulder word nice.
6793,7490,1548,2026-01-06,Paid,Worry special fine.
6794,7491,3782,2026-02-15,Paid,Create discuss approach system cold art.
6795,7492,492,2026-02-05,Paid,Anything they toward point vote finish surface.
6796,7493,3921,2025-05-15,Paid,Environment skin cold bad defense treatment.
6797,7494,4266,2026-02-11,Overdue,Indicate central piece boy thought visit onto wind.
6798,7495,3718,2025-07-11,Paid,A style company debate wrong on might.
6799,7496,4851,2025-11-24,Paid,Executive production general public site.
6800,7497,1247,2025-06-23,Overdue,Family far role.
6801,7498,3140,2025-03-16,Paid,Wind forget which member something candidate.
6802,7499,4519,2025-07-08,Pending,Color agency man level.
6803,7500,3276,2025-05-06,Paid,This quality hospital begin yeah really bag.
6804,7502,2810,2026-01-20,Pending,Single room arm let doctor.
6805,7504,2986,2026-02-06,Paid,Nation dark five rock population yet.
6806,7505,1919,2025-12-29,Paid,Adult city them throw Republican recently use.
6807,7506,3821,2025-07-17,Paid,Debate size cold morning.
6808,7507,1867,2026-01-03,Paid,Approach share long usually recognize him large.
6809,7508,2917,2026-02-24,Paid,Finally hope wife model western.
6810,7509,2881,2026-01-08,Paid,Response claim government than carry become.
6811,7510,1116,2025-12-24,Paid,Opportunity offer us difference tax federal power.
6812,7511,3780,2025-07-12,Overdue,During maintain however suddenly loss.
6813,7512,425,2025-08-19,Paid,Join option national song nearly letter national.
6814,7513,4036,2025-09-10,Paid,Great any impact doctor whom teacher.
6815,7514,886,2025-04-26,Overdue,Someone write certainly woman attorney.
6816,7516,4554,2025-09-04,Paid,Fill peace during pretty not consider these too.
6817,7517,1565,2026-02-22,Pending,Pay sister organization check reality improve street claim.
6818,7518,2509,2026-02-12,Paid,Want international book activity break ok.
6819,7519,481,2026-02-03,Overdue,Agency hand population president care baby fear.
6820,7521,1942,2025-12-19,Pending,Child travel trouble animal local catch heart image.
6821,7522,4378,2026-01-27,Pending,Win real value policy ready low.
6822,7523,4157,2026-02-11,Pending,Bad let huge significant.
6823,7524,2486,2025-05-10,Paid,Test clear program why she difficult own.
6824,7525,2232,2025-12-06,Pending,Purpose worker minute difficult question.
6825,7526,584,2025-05-29,Overdue,Main hair fight team will true.
6826,7527,2361,2025-12-21,Paid,Least wish leader hard.
6827,7528,3909,2025-08-26,Paid,Type local free first carry thus.
6828,7529,1218,2025-12-14,Paid,Property certain service television.
6829,7530,3966,2026-02-24,Paid,Imagine event most can forward draw.
6830,7531,2257,2026-02-18,Overdue,Source figure floor like case.
6831,7532,184,2026-01-25,Paid,Mention stand oil inside woman.
