invoice_id,job_id,invoice_amount,invoice_date,payment_status,invoice_notes
1,1,154,2025-12-13,Paid,Though ball simply.
2,2,3524,2025-10-24,Paid,Quite condition often after.
3,4,1377,2025-11-21,Paid,Light matter year agency foreign continue.
4,5,853,2026-02-20,Paid,Respond sign share.
5,6,2026,2025-09-21,Paid,Animal expert event place couple especially detail.
6,7,4622,2025-12-23,Paid,Civil part board top of him his deal.
7,9,3371,2025-10-14,Paid,Along behind hundred perform choice.
8,11,3264,2026-01-19,Paid,Act second heart why total wonder.
9,12,3621,2025-06-01,Pending,Leader up respond wear sign new still.
10,13,2864,2025-11-18,Paid,Avoid political wear name.
11,14,2936,2025-12-21,Paid,Off develop wife group often.
12,15,4548,2026-02-05,Paid,Own decide nice your big provide foreign open.
13,16,3507,2026-01-11,Pending,Admit responsibility season doctor actually practice skin.
14,17,2334,2026-02-14,Paid,Deal policy consider politics such pretty model place.
15,19,4852,2026-02-02,Paid,Where rate organization probably.
16,20,4677,2025-11-03,Paid,Hotel guy within keep surface.
17,21,2194,2025-10-15,Paid,Young security though reflect several.
18,22,1008,2025-07-31,Paid,Media require smile situation red cell arm.
19,23,1179,2025-04-17,Paid,Career tree discuss commercial.
20,24,2091,2026-02-21,Paid,Cold suggest yet.
21,26,814,2026-01-10,Paid,Describe body world rock spend either.
22,27,1247,2026-02-21,Paid,Though thought especially better now store nation.
23,28,3662,2025-10-05,Pending,Prove address design market raise.
24,29,4441,2026-02-07,Paid,Next it ask design simply approach.
25,30,4137,2025-11-28,Pending,Exist money commercial attack consumer spring American.
26,31,3680,2025-06-08,Paid,Billion perform send bit read.
27,32,1293,2026-01-28,Pending,Investment stock discussion democratic garden TV lot.
28,33,2464,2025-12-14,Pending,Business politics share.
29,34,4625,2026-02-12,Paid,How available both pull available.
30,35,3864,2025-09-24,Paid,Set least program town front civil major.
31,36,2567,2025-11-11,Paid,West best strong eight.
32,37,3160,2026-02-07,Paid,Degree card wide hit idea along subject.
33,40,623,2026-01-19,Paid,Card through challenge receive program professor themselves.
34,41,132,2026-01-03,Paid,Available carry force marriage right boy.
35,42,3901,2025-10-14,Paid,Building detail reveal help art.
36,43,2542,2026-02-21,Paid,Style fact late partner table grow.
37,44,1933,2025-05-10,Paid,Could exist newspaper truth day blue.
38,45,4789,2025-11-28,Pending,Training boy pull space wife whose herself able.
39,46,823,2026-02-14,Pending,Majority order guy film.
40,47,2193,2026-02-01,Overdue,Firm human Republican trip across single provide.
41,49,4915,2025-10-01,Pending,Allow occur sort conference.
42,50,1226,2025-07-27,Paid,Get fear girl nothing.
43,51,1327,2026-02-04,Paid,Soldier table strategy same prepare piece area.
44,52,2726,2026-01-09,Paid,Direction among sing modern Mrs picture already.
45,54,703,2025-12-03,Overdue,Along box figure dinner form reason sit.
46,55,1840,2025-09-12,Pending,Everybody news positive want their story table decision.
47,56,2249,2026-01-13,Paid,Blue way discussion through business tonight.
48,57,1676,2025-12-01,Pending,Science although forward then.
49,58,4618,2026-02-20,Paid,Program billion thank race truth same car.
50,59,2820,2026-01-25,Pending,Live family opportunity heavy its dinner claim.
51,60,3305,2026-01-23,Paid,Thought future memory finally.
52,61,1988,2025-10-02,Paid,Week manage science.
53,63,3609,2025-01-27,Paid,Enjoy call old especially.
54,64,2068,2025-06-01,Paid,Measure what drop.
55,66,2240,2025-09-14,Paid,Stand again rule owner.
56,67,115,2025-02-12,Paid,Pick true turn technology but serious contain.
57,68,405,2026-02-18,Paid,Put responsibility like cost third reach.
58,69,1221,2025-11-26,Overdue,Again stay statement common business yeah.
59,70,4911,2025-10-24,Paid,Federal suffer in part.
60,72,263,2025-10-29,Pending,Age and piece wind we safe.
61,73,1786,2025-08-25,Paid,Least call accept however student.
62,74,3606,2025-10-30,Overdue,National customer gas position four.
63,75,2942,2026-01-14,Paid,Agree body meet new me we.
64,76,383,2025-10-10,Paid,This skill do accept without only defense.
65,77,3550,2025-03-16,Paid,Campaign eye five bank.
66,78,2807,2025-07-09,Paid,Carry mention treat alone fall bed service.
67,79,3539,2025-10-15,Paid,Whether feel however fast fall receive enjoy.
68,80,3568,2025-11-27,Paid,Energy water chair leader decide production.
69,82,1309,2025-12-22,Overdue,Dog arrive whatever positive threat.
70,83,4026,2025-12-03,Paid,Avoid building final consider.
71,84,1425,2025-11-12,Paid,Success individual boy.
72,85,3361,2025-11-05,Paid,Story measure end son chance majority rest matter.
73,86,3956,2025-10-09,Paid,Want boy might remain can sort.
74,87,2386,2026-02-06,Pending,Heavy wind walk federal eight quite.
75,88,700,2026-01-01,Pending,Ground bag sport light reveal.
76,89,3407,2025-09-15,Paid,Tax now bar speech station.
77,90,4714,2025-11-07,Pending,Decision price wish month see teach.
78,91,3237,2025-06-03,Paid,Phone hospital adult research draw want.
79,92,1742,2025-10-12,Paid,Across almost relate every.
80,93,1410,2026-01-01,Overdue,Want different store today entire keep.
81,94,1394,2025-09-01,Paid,Oil food relationship task.
82,95,1366,2026-02-14,Overdue,Write fund probably however suffer growth.
83,96,3810,2025-10-15,Paid,Coach candidate course why later general since.
84,97,2227,2025-12-20,Paid,Soon few recent coach.
85,98,4472,2026-01-20,Paid,Daughter car stock small future speech.
86,99,1715,2025-10-24,Paid,Data role without home hair wind.
87,100,4034,2026-02-02,Paid,Compare strong enough performance save individual significant.
88,101,124,2025-11-22,Paid,Picture bit between prove executive generation.
89,102,1570,2026-02-04,Pending,Decide us company deal product.
90,104,3412,2025-05-23,Paid,Network throw area should series suggest.
91,105,1870,2025-11-25,Paid,She those range performance partner firm ready.
92,106,3457,2026-02-17,Overdue,Amount fear edge huge send bar.
93,107,3957,2025-11-27,Paid,Method describe person catch deep.
94,108,1787,2026-02-15,Paid,Read although interesting bill week nature late.
95,109,217,2025-10-26,Paid,Cause many girl lot decide blood option with.
96,110,4042,2025-12-28,Paid,Defense energy bar site around.
97,111,2659,2026-01-27,Paid,Available because school day bit.
98,112,2432,2026-01-04,Paid,Garden reason level often.
99,113,4674,2025-12-28,Paid,Since shoulder hit theory.
100,114,574,2026-01-10,Paid,Everything level particularly bar anything reveal.
101,115,1408,2025-11-12,Paid,Prepare study could through result thus.
102,116,1010,2025-09-07,Paid,Big court walk decade wear.
103,117,3862,2026-01-07,Paid,Condition allow professor soon.
104,118,2673,2026-02-18,Overdue,Gas late lawyer apply mother central than.
105,119,4796,2025-10-02,Pending,Pick ok maybe price blood.
106,120,4854,2026-01-07,Pending,Force culture mean Republican story budget help.
107,122,1190,2025-05-29,Paid,Much old member challenge out.
108,123,1972,2025-06-10,Paid,Many level thing quickly camera with than.
109,124,1932,2026-01-26,Pending,Base level professional bit commercial glass.
110,125,1423,2026-01-27,Paid,During garden claim hospital.
111,126,2755,2025-04-02,Overdue,Middle true turn discuss anyone.
112,127,802,2025-07-01,Pending,Hear pretty long.
113,128,2696,2026-02-16,Paid,Food certainly administration.
114,129,1324,2026-02-13,Paid,Though get case soldier scene simple help.
115,130,543,2025-07-06,Paid,Property before own.
116,131,3690,2025-11-17,Overdue,Current nation green analysis.
117,132,509,2026-01-30,Paid,Majority follow director purpose rich.
118,133,1430,2026-01-30,Paid,Day family fill suffer.
119,134,3492,2026-02-17,Pending,Girl take put agency.
120,135,1681,2025-08-17,Overdue,Small book anything generation yes raise family.
121,136,2018,2026-02-24,Paid,Tend beautiful opportunity face physical.
122,137,1044,2025-07-04,Pending,Cut other agent shake check what.
123,139,3554,2026-02-20,Paid,Blue rate sea lawyer again through.
124,140,3529,2025-11-12,Paid,Step end always cell.
125,141,279,2026-02-21,Pending,Ten pattern option trip yard once space.
126,142,102,2026-01-31,Paid,Leave entire eye will baby follow house.
127,143,2903,2025-12-28,Paid,But know truth another some able economy.
128,144,1838,2026-02-23,Paid,And idea level theory two step avoid.
129,146,4241,2025-12-01,Paid,Boy region instead pressure.
130,147,4592,2025-06-11,Paid,Congress arm art like down occur fall spend.
131,148,2519,2025-10-10,Overdue,Rise ever best want identify pretty factor.
132,149,326,2026-01-20,Paid,Pay learn financial position quality morning little see.
133,150,2062,2025-12-30,Paid,White everyone near team identify.
134,151,1214,2025-09-15,Pending,Word large eat card great.
135,152,970,2025-08-04,Pending,Feeling bed religious three benefit cut including.
136,153,225,2025-08-16,Paid,Book sort cup maintain majority.
137,154,4119,2025-11-18,Pending,Rate court offer why increase.
138,155,4381,2026-01-19,Paid,Short employee people outside behind.
139,156,2580,2025-12-10,Paid,Avoid at table like.
140,157,3249,2026-01-13,Paid,Eye back trade pass course response surface effort.
141,158,598,2026-02-06,Paid,Word myself human teach build.
142,159,514,2025-05-28,Paid,Relate never teach charge two business.
143,160,3719,2026-02-12,Paid,Trip tend floor popular.
144,161,3574,2025-08-26,Pending,Through structure draw certainly.
145,162,3815,2025-06-14,Pending,Environmental yard different future view technology dream rise.
146,163,3973,2026-02-01,Paid,Should kind significant career without professor.
147,164,3556,2025-10-05,Paid,Report someone available say.
148,165,1663,2026-02-23,Pending,Yes price task face include.
149,166,1388,2026-02-04,Paid,Reach bank against study clearly at road.
150,167,754,2025-06-24,Paid,Hand into collection allow particularly this.
151,168,3889,2026-02-23,Paid,Wonder two run skin.
152,169,4264,2025-12-03,Paid,Section rest attorney trade nor book since until.
153,170,3819,2026-01-23,Paid,After management from cup treat action practice six.
154,171,2491,2026-01-19,Paid,Leave around forget reflect.
155,172,538,2026-02-12,Paid,Memory force total production within how laugh.
156,173,4803,2025-08-12,Paid,Senior color fish education new.
157,174,3308,2025-11-15,Pending,Present to tonight term nature less.
158,175,1417,2026-01-21,Paid,Cut attention kind just sell.
159,176,4933,2025-07-10,Paid,Sometimes lot opportunity above cut with day.
160,177,3189,2026-01-02,Paid,Nature really section building.
161,178,4057,2025-07-30,Paid,Inside do together glass finally administration.
162,179,3201,2025-07-16,Paid,Wonder during might mission police.
163,180,1112,2025-10-08,Paid,Husband physical practice understand.
164,181,2199,2025-12-16,Paid,Parent leader daughter same technology certainly maintain rule.
165,182,1426,2025-04-10,Paid,Citizen side best head per.
166,183,4051,2026-02-13,Paid,Clearly scene their understand administration.
167,184,4782,2026-01-07,Paid,Rather less popular interest nearly.
168,185,3155,2025-12-25,Pending,Development writer leg leave quickly national experience.
169,186,2112,2025-10-12,Paid,Education would treatment wind.
170,187,1508,2025-11-14,Paid,Family between record need recently.
171,188,662,2025-09-08,Overdue,Subject religious available perform prepare under.
172,189,2992,2026-01-21,Paid,Moment international life race impact other.
173,190,925,2026-02-11,Paid,Opportunity clearly watch popular throughout.
174,191,2935,2025-04-10,Paid,Court either they receive.
175,192,1342,2025-12-21,Paid,Lead smile someone item news eye.
176,193,2885,2025-09-02,Pending,Prepare everything give various difference most.
177,194,2940,2025-10-29,Paid,Entire international hit black him past base oil.
178,195,1887,2026-02-15,Paid,Other probably see race.
179,196,4220,2025-07-25,Paid,Capital bring today lay right talk.
180,198,3000,2026-01-03,Paid,Attack light four heavy charge prepare certain must.
181,199,2796,2025-04-22,Pending,Brother century media blue mouth.
182,200,4612,2026-01-22,Pending,At painting bring.
183,201,3500,2026-02-01,Paid,People everybody entire experience list yeah.
184,202,2836,2026-02-21,Pending,Data song end look lead now region.
185,203,4693,2026-01-08,Paid,Collection best air open year little above.
186,206,1811,2026-02-08,Paid,I marriage increase generation but.
187,207,1113,2026-01-13,Paid,Relate director student authority wide.
188,208,904,2026-02-08,Paid,Information discover quality career your sell range.
189,209,1643,2025-09-19,Pending,Measure none leave represent pay instead benefit without.
190,210,3625,2026-01-19,Pending,Culture star at require actually spring.
191,211,4449,2025-01-08,Paid,Raise majority common even.
192,212,2551,2025-09-29,Paid,Build friend wonder fight both.
193,213,4657,2025-12-04,Paid,Speak ago whose shoulder east establish remain.
194,214,3822,2026-01-17,Paid,Myself bank experience situation hope view fill.
195,215,4001,2026-02-21,Overdue,Use best instead senior each deal.
196,216,1220,2026-02-14,Paid,Establish we really might new.
197,217,1139,2026-02-14,Paid,Safe employee nearly will join treat brother.
198,218,748,2026-01-19,Paid,Strong middle white development hold.
199,219,2737,2026-02-23,Paid,State officer safe scene.
200,221,3910,2025-10-27,Paid,Soldier long kid party.
201,222,3427,2025-10-06,Paid,First front see close.
202,224,1115,2025-10-17,Pending,International detail wish assume model.
203,225,4371,2025-12-06,Paid,Race evidence teach.
204,226,3608,2025-12-12,Pending,Collection both discover audience foot her with.
205,227,1356,2026-02-05,Pending,Paper suggest certainly level bit mouth add.
206,228,3564,2026-02-23,Paid,Whatever meet arrive threat.
207,229,1315,2025-12-19,Paid,Themselves star politics region win.
208,230,4297,2025-12-26,Pending,Break purpose movement put outside other western.
209,231,1366,2026-02-02,Paid,Close true close type research.
210,233,314,2026-02-23,Paid,Discover than still right address police.
211,234,3985,2026-02-14,Paid,Much charge business sense condition cause stay.
212,235,1305,2026-02-19,Paid,Bad in produce responsibility.
213,236,4209,2026-01-26,Paid,Any modern campaign.
214,237,895,2026-02-22,Paid,Huge officer another theory.
215,238,3927,2026-01-02,Paid,Green return shoulder cultural order never.
216,240,3092,2025-10-11,Overdue,Scientist add him mention interest.
217,241,4185,2025-12-30,Paid,He thus deep several between.
218,242,2601,2025-05-25,Overdue,Remember alone national watch goal.
219,243,3578,2025-12-28,Paid,Rich threat newspaper age sort.
220,244,2320,2026-02-12,Paid,He check close agent second Democrat one.
221,246,840,2025-04-10,Paid,Reduce ground point certain.
222,249,973,2026-02-15,Paid,Drop yard relate east line year.
223,250,119,2025-09-02,Paid,Free deal themselves.
224,251,2009,2026-02-19,Pending,Public apply computer build education what coach commercial.
225,252,976,2026-01-04,Overdue,He white fish education interview nearly.
226,253,4094,2025-12-07,Paid,Situation reveal best hospital allow.
227,254,388,2025-09-14,Paid,Hard pass must herself.
228,255,623,2025-03-13,Paid,By truth value success however field herself.
229,257,2974,2025-11-25,Paid,Area off until unit skin special large.
230,258,2029,2026-01-10,Pending,Husband tonight consumer heart out nor kind.
231,259,2847,2025-03-12,Paid,Dog type change.
232,260,4198,2026-02-17,Paid,Age early model share.
233,262,418,2026-02-12,Paid,Media pattern school later become my federal.
234,263,4295,2025-11-04,Paid,Drive real give area.
235,264,979,2025-10-26,Pending,Respond natural early.
236,265,824,2026-01-07,Pending,Kitchen my how still big information fish.
237,267,4200,2025-12-09,Paid,Different and power mind though door suddenly.
238,268,2759,2025-11-08,Overdue,Really note agency future degree loss.
239,269,3652,2025-04-23,Paid,Challenge right offer reduce four.
240,271,3858,2026-01-24,Paid,Tend impact sister.
241,272,1767,2025-11-04,Paid,Activity away word big bag.
242,274,3199,2025-11-24,Overdue,Say suddenly spring south else cost camera.
243,275,4387,2025-07-21,Paid,Society magazine scene house pick three which.
244,276,3439,2026-01-10,Paid,Career economy brother song mention military who community.
245,277,3525,2025-10-14,Overdue,Read partner senior financial discuss.
246,278,4021,2025-11-19,Paid,These Mrs day light really people.
247,279,993,2025-05-25,Overdue,Far letter subject them different again its positive.
248,280,292,2025-10-06,Paid,Billion new direction manage team.
249,281,3961,2025-10-29,Pending,Send structure hot past pattern senior word.
250,282,3341,2025-01-19,Paid,Person get those consumer pay skin happy.
251,283,229,2025-11-25,Overdue,Soon teacher chance many.
252,284,2470,2025-12-04,Overdue,Republican why operation.
253,285,2903,2025-05-30,Overdue,Off expert government.
254,287,1229,2026-02-23,Paid,Baby himself various ground head organization move item.
255,288,4303,2026-02-20,Paid,Second particular large peace think lose usually.
256,289,749,2025-11-15,Pending,Even food land finally.
257,290,3106,2026-02-22,Pending,Media suffer student member fund study tend collection.
258,291,4749,2025-10-29,Paid,Floor loss itself well.
259,292,512,2026-02-01,Paid,Pick left which reason chance at.
260,293,4259,2026-01-16,Pending,Expect you hospital health among for.
261,294,2980,2026-01-21,Paid,Price crime energy bag board.
262,295,2959,2026-01-30,Paid,Painting always someone.
263,296,2562,2025-12-20,Paid,Trial thank record boy care after.
264,297,1467,2025-11-20,Paid,Record read money wear set.
265,298,3466,2026-02-11,Paid,Across quality course for.
266,300,4679,2026-01-28,Pending,Western central identify court sound.
267,301,4173,2026-02-17,Paid,Machine so network where rate.
268,302,4442,2026-01-18,Paid,Car somebody strong last walk hard small.
269,304,4141,2026-01-10,Paid,Theory attention rock once above professional seat.
270,305,4708,2026-02-15,Paid,Tree control though activity discover personal.
271,306,2470,2025-02-13,Paid,Wall myself board into arm actually.
272,307,1863,2026-02-17,Paid,What again catch age.
273,308,2983,2026-01-11,Paid,Recently environment within what none leg debate.
274,309,168,2025-11-24,Paid,Yet plant in some.
275,310,4244,2026-02-17,Paid,Student run training cell successful most.
276,311,3610,2025-11-03,Paid,Ever career study.
277,312,1234,2025-11-18,Paid,Good simply mean reason.
278,313,3758,2026-02-07,Paid,Then impact ask large.
279,314,379,2025-10-13,Paid,Peace under into visit medical nation pressure.
280,315,480,2026-02-14,Overdue,Congress guess make trial.
281,317,948,2026-01-03,Pending,Adult toward crime.
282,318,4787,2026-02-24,Paid,Little do trial want box south.
283,319,993,2025-12-01,Pending,Make stuff available move.
284,321,638,2026-01-31,Overdue,Fish might she evening important enough hand which.
285,322,2683,2026-02-23,Pending,Relationship study air.
286,324,1911,2026-02-03,Overdue,Piece rock onto task authority mention in.
287,326,1855,2026-01-23,Paid,Including though use.
288,327,2001,2026-02-19,Paid,Cultural none matter letter where push.
289,328,1336,2025-11-27,Pending,Ok same key wait.
290,329,4741,2025-10-16,Paid,Else thus perform environment left piece best.
291,330,3526,2025-09-18,Paid,Pay husband rich.
292,331,1111,2025-12-20,Paid,Travel player society mother apply.
293,332,3736,2026-02-13,Pending,Who good the represent.
294,333,3119,2025-09-11,Paid,Home statement purpose series couple line because.
295,334,4586,2026-02-22,Paid,People agreement society attention.
296,335,2493,2025-12-03,Pending,Challenge group face toward music cost little.
297,336,1590,2025-11-22,Overdue,Run cell decade bag.
298,338,2002,2026-02-23,Paid,Religious institution street southern interesting member.
299,339,2653,2025-08-05,Pending,Rise to blood still hospital remember win.
300,340,595,2026-02-13,Paid,Fill Mrs tree develop along six.
301,341,3869,2025-11-22,Paid,Enjoy early forget less system wind.
302,342,2284,2026-01-02,Overdue,Choice along modern.
303,343,3717,2026-02-24,Paid,Decade positive theory yes current.
304,344,1239,2025-11-29,Paid,Option behavior wife president.
305,345,2128,2025-11-29,Paid,Federal increase hear return.
306,346,2506,2025-03-17,Overdue,Kitchen despite game.
307,347,3733,2026-02-12,Paid,Fear purpose call I process.
308,348,4636,2025-09-10,Pending,Listen control hold.
309,349,545,2025-08-09,Paid,Consumer save anyone break she American then.
310,350,736,2026-02-18,Paid,In follow class focus take crime.
311,351,616,2025-07-14,Pending,Mrs impact doctor same never read.
312,352,1452,2025-07-27,Paid,Least eat discussion quite interesting offer.
313,353,394,2026-01-29,Paid,He two off or save.
314,354,2975,2025-10-03,Paid,Hot experience tough manage remember reduce.
315,355,4519,2025-12-26,Paid,Draw sure pay process medical hospital than yes.
316,356,1084,2026-01-04,Paid,Language structure risk include country church.
317,357,4290,2026-02-10,Paid,Check music answer performance foreign apply.
318,359,4193,2025-09-21,Paid,General wonder road natural life forget.
319,360,3108,2025-07-22,Paid,Its how she.
320,361,2453,2025-09-24,Paid,Must body physical study.
321,362,4585,2025-11-08,Paid,Task range least well approach measure.
322,363,1341,2025-07-27,Pending,A may after.
323,364,3284,2026-02-04,Paid,Race go population.
324,365,4078,2025-08-28,Paid,Prevent true true player over.
325,366,436,2025-10-08,Paid,Particular in movement most.
326,368,1715,2026-02-20,Paid,Well within human take that herself chance.
327,369,613,2026-02-08,Paid,Weight six health yet that.
328,370,1932,2026-02-02,Pending,College science because personal.
329,371,2402,2025-08-19,Paid,Easy stage box although act.
330,372,4928,2026-01-21,Paid,All space away become.
331,373,785,2026-02-07,Pending,Wind safe nothing its.
332,376,3985,2025-11-18,Paid,His black that national.
333,377,4549,2026-02-03,Paid,Easy available woman marriage green peace beautiful.
334,378,1826,2026-01-04,Pending,Than everything family join majority.
335,379,1367,2026-01-12,Overdue,Collection certain why those pick least.
336,380,1988,2025-12-14,Paid,Computer development have manager foot.
337,381,3124,2026-02-24,Paid,Thank authority last institution what idea.
338,382,1803,2025-12-15,Paid,Believe not require speak herself.
339,383,3583,2025-11-08,Overdue,Service the that public while coach week system.
340,384,218,2025-12-18,Paid,Budget save religious never policy.
341,385,4810,2025-02-14,Overdue,Anything your operation should beautiful.
342,386,522,2026-01-31,Paid,Organization old must.
343,387,2994,2025-12-16,Paid,Office choose education fill.
344,388,2821,2026-01-15,Paid,Meet consumer near arrive center structure.
345,389,4378,2025-09-28,Paid,Least day case quickly fear.
346,390,614,2026-01-15,Paid,Despite moment able for lose.
347,391,3610,2025-07-24,Paid,Great wait community white lay from.
348,392,4622,2026-02-22,Paid,Reduce role collection walk during.
349,393,1578,2026-02-18,Paid,Door instead no mean.
350,394,4212,2025-11-01,Pending,Road one administration back student of.
351,395,4798,2026-02-22,Paid,Source environmental car again risk husband report.
352,396,2394,2025-12-03,Paid,Seem we serve others.
353,397,659,2025-08-03,Overdue,Similar card institution apply.
354,398,3420,2025-09-21,Pending,Rise eight certain today yet record step.
355,400,4413,2025-11-18,Paid,Discussion or face despite college job realize.
356,401,2402,2025-12-14,Paid,His difference significant car none gas person per.
357,402,2283,2025-06-13,Paid,Each yard agent age.
358,403,702,2025-10-29,Paid,Edge family sense whose time imagine.
359,404,1055,2025-12-25,Paid,Resource her type name.
360,405,4940,2025-11-27,Pending,Here war federal money.
361,406,1042,2026-01-02,Paid,Probably security last social bar get forward.
362,407,1132,2025-02-02,Paid,Agency recently level tend explain he chair some.
363,408,294,2026-01-25,Pending,Quite dog investment.
364,409,3463,2026-02-05,Pending,Six billion require which music.
365,410,4339,2025-09-20,Overdue,Reveal bill company amount threat so institution.
366,411,3202,2025-09-26,Paid,Exactly cup blood food realize view.
367,412,1345,2026-02-14,Paid,Away task all husband compare down.
368,413,408,2026-02-21,Paid,Baby toward glass team little nearly kid.
369,414,3471,2025-10-27,Paid,Teach environment character edge charge finally PM.
370,415,3469,2025-11-04,Paid,Air fire evidence standard.
371,416,3409,2025-08-22,Paid,Provide different bank pretty.
372,417,1191,2025-10-31,Paid,Just once under learn sit including.
373,418,2904,2025-12-22,Overdue,Society wrong one discussion trouble our.
374,419,3924,2026-02-02,Paid,Performance never space laugh term.
375,420,4413,2026-01-22,Paid,Move fast yourself here tell develop chance rate.
376,421,3601,2026-02-20,Paid,Suffer pick reduce these worry speech own.
377,422,1546,2025-12-07,Paid,Successful performance seem.
378,423,1287,2025-06-22,Pending,Argue everybody agency job mention white story.
379,424,3851,2025-11-06,Paid,Medical policy subject evening authority stand around most.
380,425,4748,2025-05-08,Paid,Food professor site movie commercial.
381,426,3120,2025-11-27,Paid,Plant only class me.
382,427,3911,2025-12-30,Paid,Wrong learn around cup.
383,428,233,2025-10-22,Paid,Game including back different hour traditional.
384,429,980,2026-01-03,Paid,Bad about tree image much drop.
385,431,411,2026-02-22,Pending,Cold someone particularly life price.
386,432,2247,2025-10-30,Paid,News along say professor eight baby well.
387,433,4444,2025-09-12,Paid,Establish sense beautiful office.
388,434,505,2025-06-05,Pending,Drop watch social watch matter plant ten.
389,435,4902,2025-12-09,Paid,Early eye stand structure specific.
390,436,4725,2025-11-30,Paid,Rule field air southern especially language recognize clearly.
391,437,710,2025-10-21,Paid,Consumer future country into American gas.
392,438,1630,2026-02-24,Paid,Result house actually fly check professional.
