invoice_id,job_id,invoice_amount,invoice_date,payment_status,invoice_notes
4564,5030,3097,2025-09-28,Paid,Industry buy reflect responsibility national administration point.
4565,5031,2671,2025-10-08,Paid,Knowledge where team fear.
4566,5032,666,2025-07-12,Pending,Must third professor best help.
4567,5033,3206,2025-11-24,Paid,Live bit society.
4568,5034,4949,2026-02-01,Pending,Early like today oil possible.
4569,5035,732,2025-12-15,Overdue,Loss medical yes hour.
4570,5036,4703,2026-02-01,Pending,Less work fight return huge.
4571,5037,1718,2025-03-04,Pending,Training center family various.
4572,5038,3762,2025-11-26,Pending,Direction across offer bit.
4573,5039,731,2025-09-30,Paid,Live generation child above idea election.
4574,5040,4051,2025-11-30,Overdue,Dream pass admit both guess eye threat.
4575,5041,3931,2026-01-25,Paid,Similar consumer image.
4576,5042,4790,2025-09-10,Paid,Expert ago someone result.
4577,5043,3297,2025-06-29,Paid,Throughout especially before.
4578,5044,3968,2025-11-22,Paid,Still theory must move course hit attention important.
4579,5046,2708,2025-10-31,Pending,May protect describe themselves mention.
4580,5047,3074,2025-06-29,Paid,Central arm try she can.
4581,5048,1801,2026-02-24,Paid,What stage sort class find these.
4582,5049,1413,2026-01-10,Paid,Thousand now to organization organization officer too.
4583,5050,4076,2026-02-22,Overdue,Maintain late begin join free.
4584,5051,1426,2025-11-15,Paid,Go population dinner dog face travel play international.
4585,5052,1588,2025-10-05,Paid,Seek during continue your they fear reach.
4586,5053,4464,2026-02-10,Paid,Who man paper fire buy wonder.
4587,5054,2553,2025-09-08,Paid,National throughout actually Republican go enjoy.
4588,5055,1917,2025-10-30,Paid,Institution free particularly marriage look government manage.
4589,5057,2762,2026-02-19,Pending,Week cause market.
4590,5058,2392,2025-12-21,Paid,Resource commercial probably.
4591,5059,161,2025-11-14,Paid,Mrs accept enter.
4592,5060,2557,2025-12-20,Paid,Future entire western direction.
4593,5061,3574,2026-02-14,Paid,Risk best show science room which system.
4594,5062,3746,2026-01-15,Pending,Most once check day keep lead.
4595,5064,410,2025-02-13,Paid,Environment cold authority.
4596,5065,4645,2026-01-25,Paid,Grow cold from have.
4597,5066,2999,2025-10-27,Overdue,Loss add such garden relate model.
4598,5067,161,2025-11-25,Pending,Spring music leader.
4599,5068,3084,2025-12-31,Pending,There task personal market role fall.
4600,5069,2341,2026-01-30,Paid,Role that her later southern past.
4601,5070,1818,2026-01-04,Paid,Will population even book weight age then.
4602,5071,4698,2025-12-26,Paid,Foot heavy material water senior.
4603,5072,2657,2025-04-17,Paid,Age you agency ok lot fight reach.
4604,5073,977,2026-01-05,Overdue,Simple challenge list employee free.
4605,5074,686,2025-10-28,Paid,Step research sing leave more dark.
4606,5075,2629,2026-01-02,Pending,Goal although send.
4607,5078,3831,2025-12-22,Pending,West care couple create conference product case.
4608,5079,1140,2026-01-10,Paid,Really friend give if hear along.
4609,5080,2282,2026-01-27,Paid,Indicate score impact order peace.
4610,5081,1264,2026-02-11,Paid,Term condition large television teach building good.
4611,5082,4331,2025-08-27,Pending,Would budget they speak difficult room.
4612,5085,2392,2026-02-18,Pending,Democratic blue property unit article.
4613,5086,3630,2026-02-23,Paid,Line change major sit majority building just.
4614,5087,653,2025-09-16,Pending,Deep safe west grow listen bill guess.
4615,5088,1772,2025-09-02,Pending,Past beautiful the official scene.
4616,5089,3067,2026-01-15,Paid,Eat note chair mouth official center.
4617,5090,2564,2026-02-23,Paid,Service we identify measure.
4618,5092,1971,2025-03-30,Paid,Yes argue different western difference one agreement.
4619,5093,1353,2026-01-09,Paid,Sing play general on.
4620,5095,3693,2025-10-28,Paid,Hold American debate executive throughout official more law.
4621,5096,4684,2025-04-14,Pending,Full wait include edge.
4622,5097,3575,2026-01-05,Paid,Ability after return however.
4623,5098,1391,2026-01-09,Paid,War would focus hard.
4624,5099,1175,2025-08-04,Pending,Learn able particular.
4625,5100,221,2026-01-23,Pending,Ground network act great PM.
4626,5101,1455,2025-09-18,Paid,Arm case total wish management police.
4627,5102,1610,2025-06-30,Paid,Major personal right walk job.
4628,5103,4019,2026-01-16,Pending,Environmental his rest people.
4629,5104,3896,2026-02-18,Overdue,Such audience dark until again rather red.
4630,5105,4293,2026-01-06,Pending,Center push team.
4631,5106,4514,2026-01-12,Paid,Face beat feel same find plant base.
4632,5108,652,2025-09-23,Paid,Detail best more what after unit break.
4633,5109,4586,2026-02-22,Pending,Factor interest sister worker.
4634,5110,2337,2026-01-21,Paid,Central since half add professional to.
4635,5111,1190,2026-01-11,Paid,Media reach next Mrs century page.
4636,5112,4662,2026-02-21,Paid,We last already rather particularly.
4637,5114,1025,2025-03-22,Pending,International training over organization alone do.
4638,5115,3275,2026-01-31,Pending,Trouble hand full dinner others lose.
4639,5116,1735,2025-06-25,Pending,Involve hundred since third any marriage final.
4640,5117,3511,2025-05-27,Paid,Crime style end finally accept too.
4641,5118,631,2025-10-30,Pending,A suffer seem east next.
4642,5119,921,2026-02-23,Paid,Data task action among such day.
4643,5120,2597,2025-06-02,Paid,Piece piece arm approach.
4644,5121,820,2025-08-10,Paid,Control film set hear draw.
4645,5122,3010,2026-02-20,Pending,Exactly response American not unit.
4646,5123,3110,2025-09-20,Paid,Accept item mean possible site shake.
4647,5124,404,2026-02-20,Paid,Suddenly material executive wife ability vote.
4648,5125,3727,2025-08-02,Paid,Sit professional tough not.
4649,5126,3855,2026-02-10,Paid,Say grow in either consider rise.
4650,5127,2696,2026-02-11,Pending,Late experience collection tax money special go.
4651,5128,564,2025-11-28,Paid,Particularly statement others month city.
4652,5129,2539,2026-01-31,Pending,Everything research like finally less.
4653,5130,1244,2026-02-13,Overdue,Back assume nation eat material here herself.
4654,5131,4909,2025-09-13,Paid,Almost last room course feeling firm especially.
4655,5132,1099,2026-02-16,Paid,Rule morning air student.
4656,5133,2994,2026-02-16,Pending,Top middle mission money.
4657,5134,764,2025-12-26,Paid,Couple health tell personal mouth that message.
4658,5136,574,2026-02-11,Pending,Change character pressure.
4659,5137,439,2025-12-17,Paid,Issue behind clearly.
4660,5138,100,2026-02-18,Paid,Hundred follow report.
4661,5139,4203,2025-11-03,Paid,Garden grow mean do cold market.
4662,5140,4541,2025-07-07,Overdue,Hear understand require wall help situation.
4663,5141,1489,2025-11-11,Paid,Chance reason camera assume security financial give.
4664,5142,1507,2025-11-24,Paid,Front plant tell.
4665,5143,2918,2025-09-18,Paid,Hope painting start writer measure.
4666,5144,3920,2025-12-10,Pending,A remain less indicate two relationship.
4667,5145,990,2025-10-25,Paid,Bed pressure statement series then responsibility well.
4668,5147,1317,2025-12-06,Paid,Cell especially soon five.
4669,5148,641,2025-03-19,Paid,Public dream citizen compare crime nothing.
4670,5149,1026,2026-02-13,Paid,Least nothing hundred boy manage possible final without.
4671,5150,4676,2025-12-20,Pending,Benefit operation attorney use.
4672,5151,2054,2025-10-18,Pending,Behind technology another positive with.
4673,5152,2505,2025-10-26,Paid,Movement win apply state that market.
4674,5153,2482,2026-01-09,Paid,Share she others own.
4675,5154,2910,2026-02-22,Paid,Address goal piece head account.
4676,5155,4604,2026-01-21,Paid,Pass four information full.
4677,5156,1820,2026-01-27,Paid,No subject maybe fact president alone tax majority.
4678,5157,2839,2025-12-02,Pending,Leave decide also usually ready street.
4679,5158,1211,2025-05-15,Pending,Final Mrs yard year.
4680,5159,3740,2026-02-02,Paid,Change brother build story maintain.
4681,5160,705,2025-09-13,Paid,Control need catch one.
4682,5161,1790,2026-02-22,Paid,Culture serve marriage development thus final.
4683,5162,3720,2026-01-03,Paid,Support remain vote character.
4684,5163,4099,2026-02-18,Paid,Last last support product.
4685,5164,4997,2025-10-14,Paid,Rich reach current always.
4686,5165,2600,2025-06-04,Paid,So window three fund.
4687,5166,3815,2025-11-26,Paid,Section company student.
4688,5167,4183,2026-02-12,Paid,Improve tend season event maybe generation.
4689,5169,4083,2025-07-28,Paid,Simple employee attack create not score risk.
4690,5170,3375,2026-02-24,Paid,Story land data.
4691,5171,4350,2025-10-09,Paid,Relationship operation high like best so evening.
4692,5172,2212,2025-12-19,Paid,Be create positive close Congress human walk raise.
4693,5173,4295,2025-08-14,Paid,Central bill her sort mean series probably.
4694,5174,3297,2025-07-11,Paid,Two true trouble condition team investment hotel.
4695,5175,633,2025-11-07,Paid,Author way past character.
4696,5176,4644,2025-12-25,Paid,Memory fact talk girl traditional floor.
4697,5177,709,2026-02-23,Paid,Account three yeah list.
4698,5178,1282,2025-10-23,Paid,Interesting owner rich.
4699,5179,3988,2025-10-25,Paid,Tree nor until role car.
4700,5180,2542,2025-12-17,Pending,Skill tax sign.
4701,5181,3138,2025-12-02,Overdue,Among quite research throughout Republican.
4702,5182,3294,2025-11-06,Paid,Positive various understand tonight.
4703,5183,1997,2025-11-14,Paid,Investment generation memory eight feel story.
4704,5184,1902,2026-01-29,Paid,Bring upon line.
4705,5185,2669,2026-01-27,Pending,Lay to pretty report garden employee.
4706,5186,956,2026-02-19,Overdue,Watch step little mean seven break.
4707,5187,2502,2026-01-29,Paid,Old process kind your citizen.
4708,5188,4286,2025-03-20,Pending,Shake between agree perhaps store step item.
4709,5189,1611,2026-01-21,Paid,Low fly reflect society up sing good now.
4710,5190,1535,2026-01-14,Paid,Federal my investment fill strong.
4711,5191,3347,2026-01-31,Overdue,Record garden political.
4712,5194,3024,2025-04-23,Paid,Region general summer yard.
4713,5195,2390,2025-09-09,Overdue,Example center board over each.
4714,5196,1801,2025-06-04,Pending,And own beyond pretty voice.
4715,5197,3100,2026-01-25,Pending,Event along someone wall seven go way.
4716,5198,4286,2026-02-18,Overdue,Leader conference day six them.
4717,5199,4274,2025-06-12,Overdue,Out throw during current blue.
4718,5200,3406,2026-01-02,Paid,Seven moment side learn program budget news positive.
4719,5201,658,2025-12-14,Paid,Information indicate interview similar expect nor.
4720,5203,3248,2025-10-29,Paid,Probably figure this may south.
4721,5204,4819,2025-12-07,Pending,Unit traditional consider analysis change wait soldier artist.
4722,5205,3934,2025-06-10,Paid,Fine right career such usually cup.
4723,5206,3565,2025-10-14,Paid,Across wait economy often seek.
4724,5207,2462,2025-06-23,Pending,Recently scientist meeting responsibility arm.
4725,5208,616,2025-11-08,Paid,Special note rule opportunity.
4726,5209,4538,2025-12-23,Paid,Water teacher until left.
4727,5210,3665,2026-02-16,Paid,To most feeling seem.
4728,5211,864,2026-02-07,Paid,Inside actually week by.
4729,5212,1749,2025-11-29,Paid,Position meet spring continue card whom school.
4730,5213,229,2025-06-10,Paid,Option politics Mrs.
4731,5215,2375,2025-09-27,Paid,Including not person wish most this.
4732,5216,2337,2025-09-06,Pending,Majority significant wonder gas no sister.
4733,5217,3992,2025-07-13,Pending,Happy apply later economic bad around.
4734,5218,1123,2026-02-03,Paid,Trial eat born community my executive learn.
4735,5219,1606,2025-09-10,Paid,Skin professor local customer source need.
4736,5220,1486,2026-02-05,Paid,Too forget time church.
4737,5222,1393,2026-01-26,Overdue,Experience ground cut performance face participant worry success.
4738,5223,1924,2026-02-22,Paid,Mean minute money fight.
4739,5224,2685,2026-01-28,Overdue,Under ground music Mr hair.
4740,5225,434,2025-06-05,Pending,Or tell after training single phone others total.
4741,5226,2951,2025-12-12,Paid,Condition response case outside behavior choice.
4742,5228,1002,2026-02-18,Paid,Camera crime article series happy number.
4743,5229,295,2025-12-05,Paid,Side hold plan safe study affect form.
4744,5230,4768,2025-05-24,Pending,Source report laugh cell fast sit entire.
4745,5231,3842,2026-01-31,Paid,Investment military himself agree beat can author room.
4746,5232,101,2026-02-12,Paid,Of home have allow people.
4747,5233,3894,2026-01-16,Paid,Increase measure dream such establish successful discover man.
4748,5234,734,2025-10-10,Paid,Ball senior education situation move sister social vote.
4749,5235,412,2026-01-15,Paid,Star lead explain second.
4750,5236,1560,2026-01-29,Paid,Seat man economic drug.
4751,5238,2080,2026-02-05,Paid,Not reality data right find result agent.
4752,5239,1548,2026-02-11,Pending,Wonder term project sometimes test.
4753,5240,3007,2025-03-20,Paid,Thank age wind agree all cut.
4754,5241,2473,2026-02-21,Paid,What lay television develop sort.
4755,5242,1158,2026-02-21,Paid,Lay book sound rich by early reveal across.
4756,5243,1607,2026-02-16,Paid,Long it country this hospital available both.
4757,5244,646,2026-02-16,Paid,Opportunity employee reduce yes.
4758,5245,2050,2025-12-30,Paid,Collection take wife thus crime left.
4759,5246,3399,2026-02-13,Paid,Use say there cost person career.
4760,5247,4711,2026-01-28,Paid,Last green participant its under office.
4761,5249,2183,2025-06-02,Paid,Current through artist population.
4762,5250,2504,2025-10-26,Paid,School citizen require three bank long hospital.
4763,5251,1632,2025-12-19,Paid,Answer success experience manager practice support old.
4764,5252,4760,2026-01-22,Paid,Try certain stock ready water assume.
4765,5254,968,2025-12-02,Paid,Involve voice economy simple art create law.
4766,5255,4325,2026-01-23,Paid,Treatment energy down matter three paper.
4767,5256,2670,2025-06-24,Pending,Industry order address draw just.
4768,5257,2650,2025-08-30,Paid,Small run game water tell whatever.
4769,5258,2408,2025-05-12,Pending,Top concern blue management maybe project serve.
4770,5259,2703,2025-12-22,Paid,Side fact charge case spend.
4771,5260,570,2025-11-22,Paid,Rate eight accept.
4772,5261,721,2025-12-06,Overdue,A store paper happen.
4773,5262,592,2026-01-10,Paid,Mention accept on city something reveal.
4774,5264,1093,2025-11-09,Paid,Brother ten career attorney such.
4775,5265,992,2025-12-06,Overdue,Listen article score mind risk business.
4776,5266,3249,2026-01-13,Pending,North media executive bad Congress leader instead election.
4777,5268,2167,2025-04-24,Overdue,Congress I hit moment positive.
4778,5270,1706,2026-01-18,Paid,Strong young effort conference government.
4779,5273,3187,2025-05-11,Paid,Maybe rise move already require special.
4780,5274,3025,2025-12-23,Paid,Federal main yeah behind.
4781,5275,4349,2025-03-21,Paid,Defense themselves chair involve wide poor fish.
4782,5276,2575,2025-08-31,Paid,Research carry population prevent soldier personal market.
4783,5277,1730,2025-10-11,Paid,Mouth generation child management test.
4784,5278,374,2025-12-24,Paid,While million onto mother executive.
4785,5279,4170,2025-11-14,Paid,Discover letter out suffer.
4786,5280,2497,2025-09-15,Paid,Table best price government lot walk.
4787,5281,2328,2026-01-04,Pending,Talk democratic nature executive whole.
4788,5282,4123,2025-07-02,Paid,Figure particularly hour sense three seek then.
4789,5283,4075,2025-07-09,Paid,Stay our clearly edge deal military common smile.
4790,5284,4487,2025-11-13,Overdue,Second practice later relationship friend put and.
4791,5285,2921,2025-11-09,Paid,Act join note security.
4792,5286,2404,2025-09-27,Paid,Year develop Republican hope national head.
4793,5287,3436,2025-10-02,Pending,Process Mr share imagine action.
4794,5288,2052,2025-11-15,Paid,Sort season season political coach price.
4795,5289,3398,2026-02-19,Paid,Clearly meet resource hour according woman.
4796,5290,2804,2025-09-01,Pending,Address question author prevent check.
4797,5292,940,2026-01-02,Paid,Nor nothing control any institution drug.
4798,5293,3225,2026-02-11,Paid,Down work significant including.
4799,5294,1022,2026-02-01,Pending,Range anyone smile low.
4800,5295,2852,2025-06-23,Paid,Often full itself party there your same.
4801,5296,2789,2025-07-04,Paid,Street strategy customer pretty suggest condition.
4802,5297,2736,2025-11-22,Paid,Hair entire develop put human appear who.
4803,5298,705,2026-02-08,Overdue,Stand capital notice drive push loss.
4804,5299,4849,2025-10-28,Paid,The message eat knowledge fly hand.
4805,5300,1533,2025-12-29,Paid,Office a card threat find cup.
4806,5301,1412,2026-01-17,Paid,Test responsibility western.
4807,5302,3437,2026-02-23,Paid,Edge instead recognize light.
4808,5303,1090,2026-02-18,Paid,Place civil mention door situation everybody protect.
4809,5304,3542,2026-02-22,Paid,Computer dream very lead.
4810,5305,4784,2025-11-01,Pending,Discussion at add worry produce.
4811,5306,2936,2026-02-13,Paid,Tough population western every quickly popular technology.
4812,5307,1567,2025-07-18,Paid,War knowledge campaign travel.
4813,5308,2154,2025-06-01,Paid,Book practice it three analysis image.
4814,5309,2767,2025-10-19,Overdue,Dream sort character about.
4815,5310,1498,2025-08-17,Paid,War individual letter hour.
4816,5311,2367,2025-08-15,Paid,Single edge name news interesting relationship action teacher.
4817,5312,2836,2025-08-27,Paid,Song shake discussion tree.
4818,5313,1022,2026-02-16,Paid,Exist commercial worker set form result some.
4819,5314,3924,2026-02-13,Paid,Appear four answer suddenly.
4820,5316,4182,2025-12-25,Paid,Environment site can something question case just.
4821,5317,2943,2026-02-04,Paid,Politics good shoulder short.
4822,5318,1689,2025-12-25,Paid,Person small chair.
4823,5319,857,2025-12-25,Overdue,Environment give human.
4824,5320,2835,2026-02-23,Paid,Stage night center wonder road history.
4825,5321,504,2026-01-16,Overdue,Thought window executive red sort story final.
4826,5322,3270,2025-11-14,Paid,Send begin who new send life yet.
4827,5323,2115,2026-02-21,Paid,Hotel year animal price occur.
4828,5324,4460,2026-02-20,Paid,Minute sister chance.
4829,5325,3754,2025-10-11,Pending,Meet religious actually let what something.
4830,5326,3042,2025-06-06,Paid,This two fear pressure particular each pressure.
4831,5327,2134,2025-09-15,Paid,Could Republican everybody prepare system student challenge.
4832,5328,3175,2026-01-16,Paid,Environment sign but difference night heart board.
4833,5329,3179,2026-02-15,Paid,Add into skin message agreement.
4834,5330,3726,2026-01-22,Paid,Best pretty nature left conference boy behind style.
4835,5331,2181,2025-10-17,Pending,Go detail benefit street bring start however.
4836,5332,3058,2025-12-31,Paid,Mr point similar.
4837,5333,4846,2025-12-20,Paid,Open level specific price statement.
4838,5335,1697,2026-02-15,Paid,Perform difference way.
4839,5336,1162,2025-12-11,Paid,Democratic have affect friend.
4840,5337,215,2025-06-11,Paid,Increase friend produce only.
4841,5338,2069,2026-02-19,Paid,Hope point morning discover.
4842,5339,1799,2025-11-25,Paid,Dark watch stock feeling glass want last.
4843,5340,2510,2026-02-15,Paid,Meeting garden heavy inside production financial everything economy.
4844,5341,4527,2025-09-26,Overdue,Conference ready threat anything.
4845,5342,271,2026-01-20,Paid,Prove card worry along.
4846,5343,2039,2026-01-27,Paid,Ok live together raise probably.
4847,5344,4589,2026-01-31,Paid,Participant resource civil as money we.
4848,5345,3253,2026-02-12,Paid,Forget direction wear onto approach claim.
4849,5346,2242,2026-02-17,Overdue,Range instead special.
4850,5347,4840,2026-01-07,Paid,I group store.
4851,5348,4777,2025-11-14,Pending,Those black while.
4852,5349,1954,2025-12-30,Paid,Himself draw wonder after should join whom.
4853,5350,628,2025-11-29,Overdue,Someone herself subject put.
4854,5351,4553,2025-09-18,Pending,Throw operation difference answer property camera hit.
4855,5352,2501,2025-11-10,Paid,Agreement soldier nor court.
4856,5353,882,2025-10-30,Paid,Interest throughout establish former.
4857,5355,2236,2025-09-27,Paid,More step new eye yard commercial imagine call.
4858,5356,230,2026-01-19,Paid,Service throughout day these hard.
4859,5357,1803,2026-02-13,Pending,Action I clearly effect couple our feeling.
4860,5358,1568,2025-12-26,Pending,Hand significant feel all wife consider reveal simply.
4861,5360,4719,2025-12-07,Paid,Cause smile begin spend.
4862,5361,2378,2025-07-30,Pending,Reality conference level surface risk.
4863,5362,988,2026-02-15,Paid,Station hundred hand particular maintain under chance.
4864,5363,391,2026-01-27,Paid,Rich cover son game.
4865,5364,4009,2026-02-03,Paid,Suffer someone mother she trial rather.
4866,5365,4991,2025-10-13,Overdue,Check go race.
4867,5366,4028,2025-12-12,Paid,Health inside improve first sing apply dream.
4868,5367,1442,2026-02-22,Paid,Few fear your traditional pattern.
4869,5368,535,2025-10-06,Paid,Quite career PM.
4870,5369,868,2025-11-28,Paid,Go exactly outside court drop industry.
4871,5370,4511,2025-06-27,Paid,Accept speech western man enough building design hard.
4872,5372,540,2026-02-18,Paid,Concern hundred music nature popular international ready.
4873,5373,2301,2026-02-20,Paid,None light full speak order.
4874,5374,1773,2025-12-06,Paid,Our act particular expert.
4875,5375,279,2025-12-02,Overdue,Assume state cover customer stand whose director.
4876,5376,608,2026-01-01,Paid,Boy sort society set.
4877,5378,780,2025-12-16,Paid,Usually south woman local drug education.
4878,5379,3823,2026-01-21,Paid,Even tough peace fund son exactly after.
4879,5380,3482,2026-01-23,Paid,Bank away back great maybe follow.
4880,5381,3353,2025-12-12,Overdue,Audience likely away couple left part.
4881,5382,4874,2025-11-09,Paid,It song leave use think with share PM.
4882,5383,4100,2026-02-06,Overdue,Politics protect house same.
4883,5384,195,2026-01-05,Paid,Clear man quickly respond across line son owner.
4884,5385,2701,2026-01-01,Paid,Conference behind property trouble ever rest.
4885,5386,415,2025-07-24,Paid,Of join too myself.
4886,5387,3362,2026-01-01,Paid,Also walk author a pick.
4887,5388,784,2026-02-08,Paid,Try physical grow result religious.
4888,5389,3392,2025-11-13,Pending,Food impact sense rest hour simply.
4889,5390,4056,2026-02-17,Paid,Reduce lawyer force.
4890,5391,2749,2026-01-14,Pending,Fast us try left nature.
4891,5392,2770,2025-12-26,Pending,Matter above minute.
4892,5393,3037,2025-11-12,Paid,Although citizen especially water cup keep.
4893,5394,2653,2026-01-17,Paid,Billion his home letter population report game parent.
4894,5395,487,2025-08-20,Paid,Ten dinner concern seem expert west anyone.
4895,5396,1658,2026-02-15,Pending,Traditional but already baby management benefit son upon.
4896,5397,1899,2026-02-07,Pending,Idea foot entire again owner building culture.
4897,5398,1822,2026-02-09,Paid,Painting artist kitchen.
4898,5399,2299,2025-11-23,Paid,Wall board summer space gun.
4899,5400,4362,2026-01-15,Paid,Subject next body value wall campaign.
4900,5401,2120,2025-10-10,Overdue,Analysis discuss various huge organization compare.
4901,5402,4913,2026-01-10,Paid,Television wonder few between morning local term wind.
4902,5403,1180,2026-01-03,Paid,Sea fill seat.
4903,5404,2359,2025-11-25,Paid,Whose make black bed past memory.
4904,5405,650,2025-12-01,Paid,Instead color condition stock.
4905,5406,1191,2025-12-20,Paid,Position modern manager admit either.
4906,5407,1296,2025-03-24,Paid,Letter worry one right arm old guy.
4907,5408,2732,2025-07-28,Paid,Marriage it now want physical.
4908,5409,3237,2025-10-30,Paid,Thousand certain apply like near.
4909,5410,3958,2025-08-22,Paid,Agree pressure unit you.
4910,5411,1277,2025-11-09,Paid,Surface less avoid firm.
4911,5412,3144,2026-02-16,Paid,Or side before pick else civil blue hit.
4912,5413,2170,2025-07-26,Paid,Imagine know travel reveal hospital.
4913,5414,1336,2025-12-07,Overdue,Best cut past authority skin.
4914,5415,2819,2026-01-04,Overdue,Win skill ready every art source.
4915,5416,3915,2026-02-09,Paid,American do without sport.
4916,5417,2854,2025-08-07,Pending,Describe political low discuss none.
4917,5418,146,2025-10-23,Overdue,Health glass various reality own later.
4918,5419,4287,2025-01-28,Paid,Claim parent strategy other manager.
4919,5420,1912,2026-02-03,Paid,General tree decide rest.
4920,5421,2926,2026-01-11,Paid,Candidate garden front hear may.
4921,5422,3466,2025-12-31,Pending,Eat computer here fly mean.
4922,5424,1366,2026-02-24,Paid,Trade total ago what traditional.
4923,5425,3514,2025-09-24,Paid,Either race them.
4924,5426,3354,2025-06-17,Paid,Speech discuss imagine.
4925,5427,3939,2025-06-13,Pending,Several really second business.
4926,5428,1283,2025-08-31,Paid,Tend even single eat movie state yes.
4927,5429,1956,2026-01-30,Pending,Up effect fund effort picture build water summer.
4928,5430,1621,2025-08-15,Paid,Black work none realize truth song company travel.
4929,5431,675,2025-07-30,Paid,Where people arm much season bar.
4930,5432,3233,2026-01-28,Paid,Computer better offer network.
4931,5433,1991,2026-01-20,Paid,Officer can break.
4932,5435,3794,2026-01-21,Paid,Hair next develop face management.
4933,5436,2095,2025-10-28,Paid,Section artist rich necessary pattern.
4934,5437,644,2026-02-02,Paid,Stand stage film yourself.
4935,5438,735,2025-08-01,Paid,That different animal draw serve serious.
4936,5439,473,2025-12-18,Paid,Poor certainly team seek wear kid cut.
4937,5443,685,2026-02-15,Paid,Ready help peace leave sing example head recently.
4938,5444,4598,2025-12-02,Pending,Thus thank those according middle somebody nor.
4939,5445,1555,2026-02-16,Paid,Population local religious story natural.
4940,5446,2204,2026-01-29,Paid,Marriage serious keep social adult tonight stage.
4941,5447,3626,2025-09-25,Paid,Far cell fact pick.
4942,5448,2170,2025-11-30,Pending,Just onto think effect.
